Description,Code,Parent
"AGRICULTURE, FORESTRY AND FISHING",A,Is parent
"Crop and animal production, hunting and related service activities",01,A
Growing of non-perennial crops,011,01
"Growing of cereals (except rice), leguminous crops and oil seeds",01110,011
Growing of rice,01120,011
"Growing of vegetables and melons, roots and tubers",01130,011
Growing of sugar cane,01140,011
Growing of tobacco,01150,011
Growing of fibre crops,01160,011
Growing of other non-perennial crops,01190,011
Growing of perennial crops,012,01
Growing of grapes,01210,012
Growing of tropical and subtropical fruits,01220,012
Growing of citrus fruits,01230,012
Growing of pome fruits and stone fruits,01240,012
Growing of other tree and bush fruits and nuts,01250,012
Growing of oleaginous fruits,01260,012
Growing of beverage crops,01270,012
"Growing of spices, aromatic, drug and pharmaceutical crops",01280,012
Growing of other perennial crops,01290,012
Plant propagation,013,01
Plant propagation,01300,013
Animal production,014,01
Raising of dairy cattle,01410,014
Raising of other cattle and buffaloes,01420,014
Raising of horses and other equines,01430,014
Raising of camels and camelids,01440,014
Raising of sheep and goats,01450,014
Raising of swinepigs,01460,014
Raising of poultry,01470,014
Raising of other animals,01490,014
Mixed farming,015,01
Mixed farming,01500,015
Support activities to agriculture and post-harvest crop activities,016,01
Support activities for crop production,01610,016
Support activities for animal production,01620,016
Farm animal boarding and care,01621,01620
Support activities for animal production (other than farm animal boarding and care) nec,01629,01620
Post-harvest crop activities,01630,016
Seed processing for propagation,01640,016
"Hunting, trapping and related service activities",017,01
"Hunting, trapping and related service activities",01700,017
Forestry and logging,02,A
Silviculture and other forestry activities,021,02
Silviculture and other forestry activities,02100,021
Logging,022,02
Logging,02200,022
Gathering of wild growing non-wood products,023,02
Gathering of wild growing non-wood products,02300,023
Support services to forestry,024,02
Support services to forestry,02400,024
Fishing and aquaculture,03,A
Fishing,031,03
Marine fishing,03110,031
Freshwater fishing,03120,031
Aquaculture,032,03
Marine aquaculture,03210,032
Freshwater aquaculture,03220,032
MINING AND QUARRYING,B,Is parent
Mining of coal and lignite,05,B
Mining of hard coal,051,05
Mining of hard coal,05100,051
Mining of hard coal from deep coal mines (underground mining),05101,05100
Mining of hard coal from open cast coal working (surface mining),05102,05100
Mining of lignite,052,05
Mining of lignite,05200,052
Extraction of crude petroleum and natural gas,06,B
Extraction of crude petroleum,061,06
Extraction of crude petroleum,06100,061
Extraction of natural gas,062,06
Extraction of natural gas,06200,062
Mining of metal ores,07,B
Mining of iron ores,071,07
Mining of iron ores,07100,071
Mining of non-ferrous metal ores,072,07
Mining of uranium and thorium ores,07210,072
Mining of other non-ferrous metal ores,07290,072
Other mining and quarrying,08,B
"Quarrying of stone, sand and clay",081,08
"Quarrying of ornamental and building stone, limestone, gypsum, chalk and slate",08110,081
Operation of gravel and sand pits; mining of clays and kaolin,08120,081
Mining and quarrying nec,089,08
Mining of chemical and fertiliser minerals,08910,089
Extraction of peat,08920,089
Extraction of salt,08930,089
Other mining and quarrying nec,08990,089
Mining support service activities,09,B
Support activities for petroleum and natural gas extraction,091,09
Support activities for petroleum and natural gas extraction,09100,091
Support activities for other mining and quarrying,099,09
Support activities for other mining and quarrying,09900,099
MANUFACTURING,C,Is parent
Manufacture of food products,10,C
Processing and preserving of meat and production of meat products,101,10
Processing and preserving of meat,10110,101
Processing and preserving of poultry meat,10120,101
Production of meat and poultry meat products,10130,101
"Processing and preserving of fish, crustaceans and molluscs",102,10
"Processing and preserving of fish, crustaceans and molluscs",10200,102
Processing and preserving of fruit and vegetables,103,10
Processing and preserving of potatoes,10310,103
Manufacture of fruit and vegetable juice,10320,103
Other processing and preserving of fruit and vegetables,10390,103
Manufacture of vegetable and animal oils and fats,104,10
Manufacture of oils and fats,10410,104
Manufacture of margarine and similar edible fats,10420,104
Manufacture of dairy products,105,10
Operation of dairies and cheese making,10510,105
Liquid milk and cream production,10511,10510
Butter and cheese production,10512,10510
"Manufacture of milk products (other than liquid milk and cream, butter, cheese) nec",10519,10510
Manufacture of ice cream,10520,105
"Manufacture of grain mill products, starches and starch products",106,10
Manufacture of grain mill products,10610,106
Grain milling,10611,10610
Manufacture of breakfast cereals and cereals-based foods,10612,10610
Manufacture of starches and starch products,10620,106
Manufacture of bakery and farinaceous products,107,10
Manufacture of bread; manufacture of fresh pastry goods and cakes,10710,107
Manufacture of rusks and biscuits; manufacture of preserved pastry goods and cakes,10720,107
"Manufacture of macaroni, noodles, couscous and similar farinaceous products",10730,107
Manufacture of other food products,108,10
Manufacture of sugar,10810,108
"Manufacture of cocoa, chocolate and sugar confectionery",10820,108
"Manufacture of cocoa, and chocolate confectionery",10821,10820
Manufacture of sugar confectionery,10822,10820
Processing of tea and coffee,10830,108
Tea processing,10831,10830
Production of coffee and coffee substitutes,10832,10830
Manufacture of condiments and seasonings,10840,108
Manufacture of prepared meals and dishes,10850,108
Manufacture of homogenised food preparations and dietetic food,10860,108
Manufacture of other food products nec,10890,108
Manufacture of prepared animal feeds,109,10
Manufacture of prepared feeds for farm animals,10910,109
Manufacture of prepared pet foods,10920,109
Manufacture of beverages,11,C
Manufacture of beverages,110,11
"Distilling, rectifying and blending of spirits",11010,110
Manufacture of wine from grape,11020,110
Manufacture of cider and other fruit wines,11030,110
Manufacture of other non-distilled fermented beverages,11040,110
Manufacture of beer,11050,110
Manufacture of malt,11060,110
Manufacture of soft drinks; production of mineral waters and other bottled waters,11070,110
Manufacture of tobacco products,12,C
Manufacture of tobacco products,120,12
Manufacture of tobacco products,12000,120
Manufacture of textiles,13,C
Preparation and spinning of textile fibres,131,13
Preparation and spinning of textile fibres,13100,131
Weaving of textiles,132,13
Weaving of textiles,13200,132
Finishing of textiles,133,13
Finishing of textiles,13300,133
Manufacture of other textiles,139,13
Manufacture of knitted and crocheted fabrics,13910,139
"Manufacture of made-up textile articles, except apparel",13920,139
Manufacture of soft furnishings,13921,13920
"Manufacture of canvas goods, sacks etc",13922,13920
Manufacture of household textiles (other than soft furnishings of 13921),13923,13920
Manufacture of carpets and rugs,13930,139
Manufacture of woven or tufted carpets and rugs,13931,13930
Manufacture of carpets and rugs (other than woven or tufted) nec,13939,13930
"Manufacture of cordage, rope, twine and netting",13940,139
"Manufacture of non-wovens and articles made from non-wovens, except apparel",13950,139
Manufacture of other technical and industrial textiles,13960,139
Manufacture of other textiles nec,13990,139
Manufacture of wearing apparel,14,C
"Manufacture of wearing apparel, except fur apparel",141,14
Manufacture of leather clothes,14110,141
Manufacture of workwear,14120,141
Manufacture of other outerwear,14130,141
"Manufacture of men's outerwear, other than leather clothes and workwear",14131,14130
"Manufacture of women's outerwear, other than leather clothes and workwear",14132,14130
Manufacture of underwear,14140,141
Manufacture of men's underwear,14141,14140
Manufacture of women's underwear,14142,14140
Manufacture of other wearing apparel and accessories,14190,141
Manufacture of articles of fur,142,14
Manufacture of articles of fur,14200,142
Manufacture of knitted and crocheted appare,143,14
Manufacture of knitted and crocheted hosiery,14310,143
Manufacture of other knitted and crocheted apparel,14390,143
Manufacture of leather and related products,15,C
Manufacture of leather and related products,151,15
Tanning and dressing of leather; dressing and dyeing of fur,15110,151
"Manufacture of luggage, handbags and the like, saddlery and harness",15120,151
Manufacture of footwear,152,15
Manufacture of footwear,15200,152
"Manufacture of wood and of products of wood and cork, except furniture; manufacture of articles of straw and plaiting materials",16,C
Sawmilling and planing of wood,161,16
Sawmilling and planing of wood,16100,161
"Manufacture of products of wood, cork, straw and plaiting materials",162,16
Manufacture of veneer sheets and wood-based panels,16210,162
Manufacture of assembled parquet floors,16220,162
Manufacture of other builders' carpentry and joinery,16230,162
Manufacture of wooden containers,16240,162
"Manufacture of other products of wood; manufacture of articles of cork, straw and plaiting materials",16290,162
Manufacture of paper and paper products,17,C
"Manufacture of pulp, paper and paperboard",171,17
Manufacture of pulp,17110,171
Manufacture of paper and paperboard,17120,171
Manufacture of articles of paper and paperboard,172,17
Manufacture of corrugated paper and paperboard and of containers of paper and paperboard,17210,172
Manufacture of corrugated paper and paperboard; manufacture of sacks and bags of paper,17211,17210
Manufacture of paper and paperboard containers other than sacks and bags,17219,17210
Manufacture of household and sanitary goods and of toilet requisites,17220,172
Manufacture of paper stationery,17230,172
Manufacture of wallpaper,17240,172
Manufacture of other articles of paper and paperboard,17290,172
Printing and reproduction of recorded media,18,C
Printing and service activities related to printing,181,18
Printing of newspapers,18110,181
Other printing,18120,181
Manufacture of printed labels,18121,18120
Printing (other than printing of newspapers and printing on labels and tags) nec,18129,18120
Pre-press and pre-media services,18130,181
Binding and related services,18140,181
Reproduction of recorded media,182,18
Reproduction of recorded media,18200,182
Reproduction of sound recording,18201,18200
Reproduction of video recording,18202,18200
Reproduction of computer media,18203,18200
Manufacture of coke and refined petroleum products,19,C
Manufacture of coke oven products,191,19
Manufacture of coke oven products,19100,191
Manufacture of refined petroleum products,192,19
Manufacture of refined petroleum products,19200,192
Mineral oil refining,19201,19200
Other treatment of petroleum products (excluding mineral oil refiningpetrochemicals manufacture),19209,19200
Manufacture of chemicals and chemical products,20,C
"Manufacture of basic chemicals, fertilisers and nitrogen compounds, plastics and synthetic rubber in primary forms",201,20
Manufacture of industrial gases,20110,201
Manufacture of dyes and pigments,20120,201
Manufacture of other inorganic basic chemicals,20130,201
Manufacture of other organic basic chemicals,20140,201
Manufacture of fertilisers and nitrogen compounds,20150,201
Manufacture of plastics in primary forms,20160,201
Manufacture of synthetic rubber in primary forms,20170,201
Manufacture of pesticides and other agrochemical products,202,20
Manufacture of pesticides and other agrochemical products,20200,202
"Manufacture of paints, varnishes and similar coatings, printing ink and mastics",203,20
"Manufacture of paints, varnishes and similar coatings, printing ink and mastics",20300,203
"Manufacture of paints, varnishes and similar coatings, mastics and sealants",20301,20300
Manufacture of printing ink,20302,20300
"Manufacture of soap and detergents, cleaning and polishing preparations, perfumes and toilet preparations",204,20
"Manufacture of soap and detergents, cleaning and polishing preparations",20410,204
Manufacture of soap and detergents,20411,20410
Manufacture of cleaning and polishing preparations,20412,20410
Manufacture of perfumes and toilet preparations,20420,204
Manufacture of other chemical products,205,20
Manufacture of explosives,20510,205
Manufacture of glues,20520,205
Manufacture of essential oils,20530,205
Manufacture of other chemical products nec,20590,205
Manufacture of man-made fibres,206,20
Manufacture of man-made fibres,20600,206
Manufacture of basic pharmaceutical products and pharmaceutical preparations,21,C
Manufacture of basic pharmaceutical products,211,21
Manufacture of basic pharmaceutical products,21100,211
Manufacture of pharmaceutical preparations,212,21
Manufacture of pharmaceutical preparations,21200,212
Manufacture of rubber and plastic products,22,C
Manufacture of rubber products,221,22
Manufacture of rubber tyres and tubes; retreading and rebuilding of rubber tyres,22110,221
Manufacture of other rubber products,22190,221
Manufacture of plastics products,222,22
"Manufacture of plastic plates, sheets, tubes and profiles",22210,222
Manufacture of plastic packing goods,22220,222
Manufacture of builders’ ware of plastic,22230,222
Manufacture of other plastic products,22290,222
Manufacture of other non-metallic mineral products,23,C
Manufacture of glass and glass products,231,23
Manufacture of flat glass,23110,231
Shaping and processing of flat glass,23120,231
Manufacture of hollow glass,23130,231
Manufacture of glass fibres,23140,231
"Manufacture and processing of other glass, including technical glassware",23190,231
Manufacture of refractory products,232,23
Manufacture of refractory products,23200,232
Manufacture of clay building materials,233,23
Manufacture of ceramic tiles and flags,23310,233
"Manufacture of bricks, tiles and construction products, in baked clay",23320,233
Manufacture of other porcelain and ceramic products,234,23
Manufacture of ceramic household and ornamental articles,23410,234
Manufacture of ceramic sanitary fixtures,23420,234
Manufacture of ceramic insulators and insulating fittings,23430,234
Manufacture of other technical ceramic products,23440,234
Manufacture of other ceramic products,23490,234
"Manufacture of cement, lime and plaster",235,23
Manufacture of cement,23510,235
Manufacture of lime and plaster,23520,235
"Manufacture of articles of concrete, cement and plaster",236,23
Manufacture of concrete products for construction purposes,23610,236
Manufacture of plaster products for construction purposes,23620,236
Manufacture of ready-mixed concrete,23630,236
Manufacture of mortars,23640,236
Manufacture of fibre cement,23650,236
"Manufacture of other articles of concrete, plaster and cement",23690,236
"Cutting, shaping and finishing of stone",237,23
"Cutting, shaping and finishing of stone",23700,237
Manufacture of abrasive products and non-metallic mineral products nec,239,23
Production of abrasive products,23910,239
Manufacture of other non-metallic mineral products nec,23990,239
Manufacture of basic metals,24,C
Manufacture of basic iron and steel and of ferro-alloys,241,24
Manufacture of basic iron and steel and of ferro-alloys,24100,241
"Manufacture of tubes, pipes, hollow profiles and related fittings, of steel",242,24
"Manufacture of tubes, pipes, hollow profiles and related fittings, of steel",24200,242
Manufacture of other products of first processing of steel,243,24
Cold drawing of bars,24310,243
Cold rolling of narrow strip,24320,243
Cold forming or folding,24330,243
Cold drawing of wire,24340,243
Manufacture of basic precious and other non-ferrous metals,244,24
Precious metals production,24410,244
Aluminium production,24420,244
"Lead, zinc and tin production",24430,244
Copper production,24440,244
Other non-ferrous metal production,24450,244
Processing of nuclear fuel,24460,244
Casting of metals,245,24
Casting of iron,24510,245
Casting of steel,24520,245
Casting of light metals,24530,245
Casting of other non-ferrous metals,24540,245
"Manufacture of fabricated metal products, except machinery and equipment",25,C
Manufacture of structural metal products,251,25
Manufacture of metal structures and parts of structures,25110,251
Manufacture of doors and windows of metal,25120,251
"Manufacture of tanks, reservoirs and containers of metal",252,25
Manufacture of central heating radiators and boilers,25210,252
"Manufacture of other tanks, reservoirs and containers of metal",25290,252
"Manufacture of steam generators, except central heating hot water boilers",253,25
"Manufacture of steam generators, except central heating hot water boilers",25300,253
Manufacture of weapons and ammunition,254,25
Manufacture of weapons and ammunition,25400,254
"Forging, pressing, stamping and roll-forming of metal; powder metallurgy",255,25
"Forging, pressing, stamping and roll-forming of metal; powder metallurgy",25500,255
Treatment and coating of metals; machining,256,25
Treatment and coating of metals,25610,256
Machining,25620,256
"Manufacture of cutlery, tools and general hardware",257,25
Manufacture of cutlery,25710,257
Manufacture of locks and hinges,25720,257
Manufacture of tools,25730,257
Manufacture of other fabricated metal products,259,25
Manufacture of steel drums and similar containers,25910,259
Manufacture of light metal packaging,25920,259
"Manufacture of wire products, chain and springs",25930,259
Manufacture of fasteners and screw machine products,25940,259
Manufacture of other fabricated metal products nec,25990,259
"Manufacture of computer, electronic and optical products",26,C
Manufacture of electronic components and boards,261,26
Manufacture of electronic components,26110,261
Manufacture of loaded electronic boards,26120,261
Manufacture of computers and peripheral equipment,262,26
Manufacture of computers and peripheral equipment,26200,262
Manufacture of communication equipment,263,26
Manufacture of communication equipment,26300,263
Manufacture of telegraph and telephone apparatus and equipment,26301,26300
Manufacture of communication equipment (other than telegraph and telephone apparatus and equipment),26309,26300
Manufacture of consumer electronics,264,26
Manufacture of consumer electronics,26400,264
"Manufacture of instruments and appliances for measuring, testing and navigation; watches and clocks",265,26
"Manufacture of instruments and appliances for measuring, testing and navigation",26510,265
"Manufacture of electronic instruments and appliances for measuring, testing, and navigation, except industrial process control equipment",26511,26510
Manufacture of electronic industrial process control equipment,26512,26510
"Manufacture of non-electronic instruments and appliances for measuring, testing and navigation, except industrial process control equipment",26513,26510
Manufacture of non-electronic industrial process control equipment,26514,26510
Manufacture of watches and clocks,26520,265
"Manufacture of irradiation, electromedical and electrotherapeutic equipment",266,26
"Manufacture of irradiation, electromedical and electrotherapeutic equipment",26600,266
Manufacture of optical instruments and photographic equipment,267,26
Manufacture of optical instruments and photographic equipment,26700,267
Manufacture of optical precision instruments,26701,26700
Manufacture of photographic and cinematographic equipment,26702,26700
Manufacture of magnetic and optical media,268,26
Manufacture of magnetic and optical media,26800,268
Manufacture of electrical equipment,27,C
"Manufacture of electric motors, generators, transformers and electricity distribution and control apparatus",271,27
"Manufacture of electric motors, generators and transformers",27110,271
Manufacture of electricity distribution and control apparatus,27120,271
Manufacture of batteries and accumulators,272,27
Manufacture of batteries and accumulators,27200,272
Manufacture of wiring and wiring devices,273,27
Manufacture of fibre optic cables,27310,273
Manufacture of other electronic and electric wires and cables,27320,273
Manufacture of wiring devices,27330,273
Manufacture of electric lighting equipment,274,27
Manufacture of electric lighting equipment,27400,274
Manufacture of domestic appliances,275,27
Manufacture of electric domestic appliances,27510,275
Manufacture of non-electric domestic appliances,27520,275
Manufacture of other electrical equipment,279,27
Manufacture of other electrical equipment,27900,279
Manufacture of machinery and equipment nec,28,C
Manufacture of general purpose machinery,281,28
"Manufacture of engines and turbines, except aircraft, vehicle and cycle engines",28110,281
Manufacture of fluid power equipment,28120,281
Manufacture of other pumps and compressors,28130,281
Manufacture of pumps,28131,28130
Manufacture of compressors,28132,28130
Manufacture of other taps and valves,28140,281
"Manufacture of bearings, gears, gearing and driving elements",28150,281
Manufacture of other general-purpose machinery,282,28
"Manufacture of ovens, furnaces and furnace burners",28210,282
Manufacture of lifting and handling equipment,28220,282
Manufacture of office machinery and equipment (except computers and peripheral equipment),28230,282
Manufacture of power-driven hand tools,28240,282
Manufacture of non-domestic cooling and ventilation equipment,28250,282
Manufacture of other general-purpose machinery nec,28290,282
Manufacture of agricultural and forestry machinery,283,28
Manufacture of agricultural and forestry machinery,28300,283
Manufacture of agricultural tractors,28301,28300
Manufacture of agricultural and forestry machinery (other than agricultural tractors),28302,28300
Manufacture of metal forming machinery and machine tools,284,28
Manufacture of metal forming machinery,28410,284
Manufacture of other machine tools,28490,284
Manufacture of other special-purpose machinery,289,28
Manufacture of machinery for metallurgy,28910,289
"Manufacture of machinery for mining, quarrying and construction",28920,289
Manufacture of machinery for mining,28921,28920
Manufacture of earthmoving equipment,28922,28920
Manufacture of equipment for concrete crushing and screening roadworks,28923,28920
"Manufacture of machinery for food, beverage and tobacco processing",28930,289
"Manufacture of machinery for textile, apparel and leather production",28940,289
Manufacture of machinery for paper and paperboard production,28950,289
Manufacture of plastics and rubber machinery,28960,289
Manufacture of other special-purpose machinery nec,28990,289
"Manufacture of motor vehicles, trailers and semi-trailers",29,C
Manufacture of motor vehicles,291,29
Manufacture of motor vehicles,29100,291
Manufacture of bodies (coachwork) for motor vehicles; manufacture of trailers and semi-trailers,292,29
Manufacture of bodies (coachwork) for motor vehicles; manufacture of trailers and semi-trailers,29200,292
Manufacture of bodies (coachwork) for motor vehicles (except caravans),29201,29200
Manufacture of trailers and semi-trailers,29202,29200
Manufacture of caravans,29203,29200
Manufacture of parts and accessories for motor vehicles,293,29
Manufacture of electrical and electronic equipment for motor vehicles,29310,293
Manufacture of other parts and accessories for motor vehicles,29320,293
Manufacture of other transport equipment,30,C
Building of ships and boats,301,30
Building of ships and floating structures,30110,301
Building of pleasure and sporting boats,30120,301
Manufacture of railway locomotives and rolling stock,302,30
Manufacture of railway locomotives and rolling stock,30200,302
Manufacture of air and spacecraft and related machinery,303,30
Manufacture of air and spacecraft and related machinery,30300,303
Manufacture of military fighting vehicles,304,30
Manufacture of military fighting vehicles,30400,304
Manufacture of transport equipment nec,309,30
Manufacture of motorcycles,30910,309
Manufacture of bicycles and invalid carriages,30920,309
Manufacture of other transport equipment nec,30990,309
Manufacture of furniture,31,C
Manufacture of furniture,310,31
Manufacture of office and shop furniture,31010,310
Manufacture of kitchen furniture,31020,310
Manufacture of mattresses,31030,310
Manufacture of other furniture,31090,310
Other manufacturing,32,C
"Manufacture of jewellery, bijouterie and related articles",321,32
Striking of coins,32110,321
Manufacture of jewellery and related articles,32120,321
Manufacture of imitation jewellery and related articles,32130,321
Manufacture of musical instruments,322,32
Manufacture of musical instruments,32200,322
Manufacture of sports goods,323,32
Manufacture of sports goods,32300,323
Manufacture of games and toys,324,32
Manufacture of games and toys,32400,324
Manufacture of professional and arcade games and toys,32401,32400
Manufacture of games and toys (other than professional and arcade games and toys) nec,32409,32400
Manufacture of medical and dental instruments and supplies,325,32
Manufacture of medical and dental instruments and supplies,32500,325
Manufacturing nec,329,32
Manufacture of brooms and brushes,32910,329
