Description,Code,Parent
Other manufacturing nec,32990,329
Repair and installation of machinery and equipment,33,C
"Repair of fabricated metal products, machinery and equipment",331,33
Repair of fabricated metal products,33110,331
Repair of machinery,33120,331
Repair of electronic and optical equipment,33130,331
Repair of electrical equipment,33140,331
Repair and maintenance of ships and boats,33150,331
Repair and maintenance of aircraft and spacecraft,33160,331
Repair and maintenance of other transport equipment,33170,331
Repair of other equipment,33190,331
Installation of industrial machinery and equipment,332,33
Installation of industrial machinery and equipment,33200,332
"ELECTRICITY, GAS, STEAM AND AIR CONDITIONING SUPPLY",D,Is parent
"Electricity, gas, steam and air conditioning supply",35,D
"Electric power generation, transmission and distribution",351,35
Production of electricity,35110,351
Transmission of electricity,35120,351
Distribution of electricity,35130,351
Trade of electricity,35140,351
Manufacture of gas; distribution of gaseous fuels through mains,352,35
Manufacture of gas,35210,352
Distribution of gaseous fuels through mains,35220,352
Trade of gas through mains,35230,352
Steam and air conditioning supply,353,35
Steam and air conditioning supply,35300,353
"WATER SUPPLY; SEWERAGE, WASTE MANAGEMENT AND REMEDIATION ACTIVITIES",E,Is parent
"Water collection, treatment and supply",36,E
"Water collection, treatment and supply",360,36
"Water collection, treatment and supply",36000,360
Sewerage,37,E
Sewerage,370,37
Sewerage,37000,370
"Waste collection, treatment and disposal activities; materials recovery",38,E
Waste collection,381,38
Collection of non-hazardous waste,38110,381
Collection of hazardous waste,38120,381
Waste treatment and disposal,382,38
Treatment and disposal of non-hazardous waste,38210,382
Treatment and disposal of hazardous waste,38220,382
Materials recovery,383,38
Dismantling of wrecks,38310,383
Recovery of sorted materials,38320,383
Remediation activities and other waste management services,39,E
Remediation activities and other waste management services,390,39
Remediation activities and other waste management services,39000,390
CONSTRUCTION,F,Is parent
Construction of buildings,41,F
Development of building projects,411,41
Development of building projects,41100,411
Construction of residential and non-residential buildings,412,41
Construction of residential and non-residential buildings,41200,412
Construction of commercial buildings,41201,41200
Construction of domestic buildings,41202,41200
Civil engineering,42,F
Construction of roads and railways,421,42
Construction of roads and motorways,42110,421
Construction of railways and underground railways,42120,421
Construction of bridges and tunnels,42130,421
Construction of utility projects,422,42
Construction of utility projects for fluids,42210,422
Construction of utility projects for electricity and telecommunications,42220,422
Construction of other civil engineering projects,429,42
Construction of water projects,42910,429
Construction of other civil engineering projects nec,42990,429
Specialised construction activities,43,F
Demolition and site preparation,431,43
Demolition,43110,431
Site preparation,43120,431
Test drilling and boring,43130,431
"Electrical, plumbing and other construction installation activities",432,43
Electrical installation,43210,432
"Plumbing, heat and air-conditioning installation",43220,432
Other construction installation,43290,432
Building completion and finishing,433,43
Plastering,43310,433
Joinery installation,43320,433
Floor and wall covering,43330,433
Painting and glazing,43340,433
Painting,43341,43340
Glazing,43342,43340
Other building completion and finishing,43390,433
Other specialised construction activities,439,43
Roofing activities,43910,439
Other specialised construction activities nec,43990,439
Scaffold erection,43991,43990
Specialised construction activities (other than scaffold erection) nec,43999,43990
WHOLESALE AND RETAIL TRADE; REPAIR OF MOTOR VEHICLES AND MOTORCYCLES,G,Is parent
Wholesale and retail trade and repair of motor vehicles and motorcycles,45,G
Sale of motor vehicles,451,45
Sale of cars and light motor vehicles,45110,451
Sale of new cars and light motor vehicles,45111,45110
Sale of used cars and light motor vehicles,45112,45110
Sale of other motor vehicles,45190,451
Maintenance and repair of motor vehicles,452,45
Maintenance and repair of motor vehicles,45200,452
Sale of motor vehicle parts and accessories,453,45
Wholesale trade of motor vehicle parts and accessories,45310,453
Retail trade of motor vehicle parts and accessories,45320,453
"Sale, maintenance and repair of motorcycles and related parts and accessories",454,45
"Sale, maintenance and repair of motorcycles and related parts and accessories",45400,454
"Wholesale trade, except of motor vehicles and motorcycles",46,G
Wholesale on a fee or contract basis,461,46
"Agents involved in the sale of agricultural raw materials, live animals, textile raw materials and semi-finished goods",46110,461
"Agents involved in the sale of fuels, ores, metals and industrial chemicals",46120,461
Agents involved in the sale of timber and building materials,46130,461
"Agents involved in the sale of machinery, industrial equipment, ships and aircraft",46140,461
"Agents involved in the sale of furniture, household goods, hardware and ironmongery",46150,461
"Agents involved in the sale of textiles, clothing, fur, footwear and leather goods",46160,461
"Agents involved in the sale of food, beverages and tobacco",46170,461
Agents specialised in the sale of other particular products,46180,461
Agents involved in the sale of a variety of goods,46190,461
Wholesale of agricultural raw materials and live animals,462,46
"Wholesale of grain, unmanufactured tobacco, seeds and animal feeds",46210,462
Wholesale of flowers and plants,46220,462
Wholesale of live animals,46230,462
"Wholesale of hides, skins and leather",46240,462
"Wholesale of food, beverages and tobacco",463,46
Wholesale of fruit and vegetables,46310,463
Wholesale of meat and meat products,46320,463
"Wholesale of dairy products, eggs and edible oils and fats",46330,463
Wholesale of beverages,46340,463
"Wholesale of fruit and vegetable juices, mineral waters and soft drinks",46341,46340
"Wholesale of wine, beer, spirits and other alcoholic beverages",46342,46340
Wholesale of tobacco products,46350,463
Wholesale of sugar and chocolate and sugar confectionery,46360,463
"Wholesale of coffee, tea, cocoa and spices",46370,463
"Wholesale of other food, including fish, crustaceans and molluscs",46380,463
"Non-specialised wholesale of food, beverages and tobacco",46390,463
Wholesale of household goods,464,46
Wholesale of textiles,46410,464
Wholesale of clothing and footwear,46420,464
Wholesale of electrical household appliances,46430,464
"Wholesale of gramophone records, audio tapes, compact discs and video tapes and of the equipment on which these are played",46431,46430
"Wholesale of radio and television goods and of electrical household appliances (other than of gramophone records, audio tapes, compact discs and video tapes and the equipment on which these are played) nec",46439,46430
Wholesale of china and glassware and cleaning materials,46440,464
Wholesale of perfume and cosmetics,46450,464
Wholesale of pharmaceutical goods,46460,464
"Wholesale of furniture, carpets and lighting equipment",46470,464
Wholesale of watches and jewellery,46480,464
Wholesale of other household goods,46490,464
Wholesale of musical instruments,46491,46490
Wholesale of household goods (other than musical instruments) nec,46499,46490
Wholesale of information and communication equipment,465,46
"Wholesale of computers, computer peripheral equipment and software",46510,465
Wholesale of electronic and telecommunications equipment and parts,46520,465
"Wholesale of other machinery, equipment and supplies",466,46
"Wholesale of agricultural machinery, equipment and supplies",46610,466
Wholesale of machine tools,46620,466
"Wholesale of mining, construction and civil engineering machinery",46630,466
Wholesale of machinery for the textile industry and of sewing and knitting machines,46640,466
Wholesale of office furniture,46650,466
Wholesale of other office machinery and equipment,46660,466
Wholesale of other machinery and equipment,46690,466
Other specialised wholesale,467,46
"Wholesale of solid, liquid and gaseous fuels and related products",46710,467
Wholesale of petroleum and petroleum products,46711,46710
Wholesale of fuels and related products (other than petroleum and petroleum products),46719,46710
Wholesale of metals and metal ores,46720,467
"Wholesale of wood, construction materials and sanitary equipment",46730,467
"Wholesale of hardware, plumbing and heating equipment and supplies",46740,467
Wholesale of chemical products,46750,467
Wholesale of other intermediate products,46760,467
Wholesale of waste and scrap,46770,467
Non-specialised wholesale trade,469,46
Non-specialised wholesale trade,46900,469
"Retail trade, except of motor vehicles and motorcycles",47,G
Retail sale in non-specialised stores,471,47
"Retail sale in non-specialised stores with food, beverages or tobacco predominating",47110,471
Other retail sale in non-specialised stores,47190,471
"Retail sale of food, beverages and tobacco in specialised stores",472,47
Retail sale of fruit and vegetables in specialised stores,47210,472
Retail sale of meat and meat products in specialised stores,47220,472
"Retail sale of fish, crustaceans and molluscs in specialised stores",47230,472
"Retail sale of bread, cakes, flour confectionery and sugar confectionery in specialised stores",47240,472
Retail sale of beverages in specialised stores,47250,472
Retail sale of tobacco products in specialised stores,47260,472
Other retail sale of food in specialised stores,47290,472
Retail sale of automotive fuel in specialised stores,473,47
Retail sale of automotive fuel in specialised stores,47300,473
Retail sale of information and communication equipment in specialised stores,474,47
"Retail sale of computers, peripheral units and software in specialised stores",47410,474
Retail sale of telecommunications equipment in specialised stores,47420,474
Retail sale of mobile telephones in specialised stores,47421,47420
"Retail sale of telecommunications equipment (other than mobile telephones) nec, in specialised stores",47429,47420
Retail sale of audio and video equipment in specialised stores,47430,474
Retail sale of other household equipment in specialised stores,475,47
Retail sale of textiles in specialised stores,47510,475
"Retail sale of hardware, paints and glass in specialised stores",47520,475
"Retail sale of carpets, rugs, wall and floor coverings in specialised stores",47530,475
Retail sale of electrical household appliances in specialised stores,47540,475
"Retail sale of furniture, lighting equipment and other household articles in specialised stores",47590,475
Retail sale of musical instruments and scores in specialised stores,47591,47590
"Retail sale of furniture, lighting equipment and other household articles (other than musical instruments) nec, in specialised stores",47599,47590
Retail sale of cultural and recreation goods in specialised stores,476,47
Retail sale of books in specialised stores,47610,476
Retail sale of newspapers and stationery in specialised stores,47620,476
Retail sale of music and video recordings in specialised stores,47630,476
Retail sale of sporting equipment in specialised stores,47640,476
Retail sale of games and toys in specialised stores,47650,476
Retail sale of other goods in specialised stores,477,47
Retail sale of clothing in specialised stores,47710,477
Retail sale of footwear and leather goods in specialised stores,47720,477
Retail sale of footwear in specialised stores,47721,47720
Retail sale of leather goods in specialised stores,47722,47720
Dispensing chemist in specialised stores,47730,477
Retail sale of medical and orthopaedic goods in specialised stores,47740,477
Retail sale of hearing aids in specialised stores,47741,47740
"Retail sale of medical and orthopaedic goods (other than hearing aids) nec, in specialised stores",47749,47740
Retail sale of cosmetic and toilet articles in specialised stores,47750,477
"Retail sale of flowers, plants, seeds, fertilisers, pet animals and pet food in specialised stores",47760,477
Retail sale of watches and jewellery in specialised stores,47770,477
Other retail sale of new goods in specialised stores,47780,477
Retail sale in commercial art galleries,47781,47780
Retail sale by opticians,47782,47780
"Other retail sale of new goods in specialised stores (other than by opticians or commercial art galleries), nec",47789,47780
Retail sale of second-hand goods in stores,47790,477
"Retail sale of antiques including antique books, in stores",47791,47790
Retail sale of second-hand goods (other than antiques and antique books) in stores,47799,47790
Retail sale via stalls and markets,478,47
"Retail sale via stalls and markets of food, beverages and tobacco products",47810,478
"Retail sale via stalls and markets of textiles, clothing and footwear",47820,478
Retail sale via stalls and markets of other goods,47890,478
"Retail trade not in stores, stalls or markets",479,47
Retail sale via mail order houses or via Internet,47910,479
"Other retail sale not in stores, stalls or markets",47990,479
TRANSPORTATION AND STORAGE,H,Is parent
Land transport and transport via pipelines,49,H
"Passenger rail transport, interurban",491,49
"Passenger rail transport, interurban",49100,491
Freight rail transport,492,49
Freight rail transport,49200,492
Other passenger land transport,493,49
Urban and suburban passenger land transport,49310,493
"Urban, suburban or metropolitan area passenger railway transportation by underground, metro and similar systems",49311,49310
"Urban, suburban or metropolitan area passenger land transport other than railway transportation by underground, metro and similar systems",49319,49310
Taxi operation,49320,493
Other passenger land transport nec,49390,493
Freight transport by road and removal services,494,49
Freight transport by road,49410,494
Removal services,49420,494
Transport via pipeline,495,49
Transport via pipeline,49500,495
Water transport,50,H
Sea and coastal passenger water transport,501,50
Sea and coastal passenger water transport,50100,501
Sea and coastal freight water transport,502,50
Sea and coastal freight water transport,50200,502
Inland passenger water transport,503,50
Inland passenger water transport,50300,503
Inland freight water transport,504,50
Inland freight water transport,50400,504
Air transport,51,H
Passenger air transport,511,51
Passenger air transport,51100,511
Scheduled passenger air transport,51101,51100
Non-scheduled passenger air transport,51102,51100
Freight air transport and space transport,512,51
Freight air transport,51210,512
Space transport,51220,512
Warehousing and support activities for transportation,52,H
Warehousing and storage,521,52
Warehousing and storage,52100,521
Operation of warehousing and storage facilities for water transport activities of division 50,52101,52100
Operation of warehousing and storage facilities for air transport activities of division 51,52102,52100
Operation of warehousing and storage facilities for land transport activities of division 49,52103,52100
Support activities for transportation,522,52
Service activities incidental to land transportation,52210,522
Operation of rail freight terminals,52211,52210
Operation of rail passenger facilities at railway stations,52212,52210
Operation of bus and coach passenger facilities at bus and coach stations,52213,52210
"Other service activities incidental to land transportation, nec (not including operation of rail freight terminals, passenger facilities at railway stations or passenger facilities at bus and coach stations)",52219,52210
Service activities incidental to water transportation,52220,522
Service activities incidental to air transportation,52230,522
Cargo handling,52240,522
Cargo handling for water transport activities of division 50,52241,52240
Cargo handling for air transport activities of division 51,52242,52240
Cargo handling for land transport activities of division 49,52243,52240
Other transportation support activities,52290,522
Postal and courier activities,53,H
Postal activities under universal service obligation,531,53
Postal activities under universal service obligation,53100,531
Other postal and courier activities,532,53
Other postal and courier activities,53200,532
Licensed Carriers,53201,53200
Unlicensed Carriers,53202,53200
ACCOMMODATION AND FOOD SERVICE ACTIVITIES,I,Is parent
Accommodation,55,I
Hotels and similar accommodation,551,55
Hotels and similar accommodation,55100,551
Holiday and other short-stay accommodation,552,55
Holiday and other short-stay accommodation,55200,552
Holiday centres and villages,55201,55200
Youth hostels,55202,55200
Other holiday and other short-stay accommodation (not including holiday centres and villages or youth hostels) nec,55209,55200
"Camping grounds, recreational vehicle parks and trailer parks",553,55
"Camping grounds, recreational vehicle parks and trailer parks",55300,553
Other accommodation,559,55
Other accommodation,55900,559
Food and beverage service activities,56,I
Restaurants and mobile food service activities,561,56
Restaurants and mobile food service activities,56100,561
Licensed restaurants,56101,56100
Unlicensed restaurants and cafes,56102,56100
Take away food shops and mobile food stands,56103,56100
Event catering and other food service activities,562,56
Event catering activities,56210,562
Other food service activities,56290,562
Beverage serving activities,563,56
Beverage serving activities,56300,563
Licensed clubs,56301,56300
Public houses and bars,56302,56300
INFORMATION AND COMMUNICATION,J,Is parent
Publishing activities,58,J
"Publishing of books, periodicals and other publishing activities",581,58
Book publishing,58110,581
Publishing of directories and mailing lists,58120,581
Publishing of newspapers,58130,581
Publishing of journals and periodicals,58140,581
Publishing of learned journals,58141,58140
"Publishing of consumer, business and professional journals and periodicals",58142,58140
Other publishing activities,58190,581
Software publishing,582,58
Publishing of computer games,58210,582
Other software publishing,58290,582
"Motion picture, video and television programme production, sound recording and music publishing activities",59,J
"Motion picture, video and television programme activities",591,59
"Motion picture, video and television programme production activities",59110,591
Motion picture production activities,59111,59110
Video production activities,59112,59110
Television programme production activities,59113,59110
"Motion picture, video and television programme post-production activities",59120,591
"Motion picture, video and television programme distribution activities",59130,591
Motion picture distribution activities,59131,59130
Video distribution activities,59132,59130
Television programme distribution activities,59133,59130
Motion picture projection activities,59140,591
Sound recording and music publishing activities,592,59
Sound recording and music publishing activities,59200,592
Programming and broadcasting activities,60,J
Radio broadcasting,601,60
Radio broadcasting,60100,601
Television programming and broadcasting activities,602,60
Television programming and broadcasting activities,60200,602
Telecommunications,61,J
Wired telecommunications activities,611,61
Wired telecommunications activities,61100,611
Wireless telecommunications activities,612,61
Wireless telecommunications activities,61200,612
Satellite telecommunications activities,613,61
Satellite telecommunications activities,61300,613
Other telecommunications activities,619,61
Other telecommunications activities,61900,619
"Computer programming, consultancy and related activities",62,J
"Computer programming, consultancy and related activities",620,62
Computer programming activities,62010,620
Ready-made interactive leisure and entertainment software development,62011,62010
Business and domestic software development,62012,62010
Computer consultancy activities,62020,620
Computer facilities management activities,62030,620
Other information technology and computer service activities,62090,620
Information service activities,63,J
"Data processing, hosting and related activities; web portals",631,63
"Data processing, hosting and related activities",63110,631
Web portals,63120,631
Other information service activities,639,63
News agency activities,63910,639
Other information service activities nec,63990,639
FINANCIAL AND INSURANCE ACTIVITIES,K,Is parent
"Financial service activities, except insurance and pension funding",64,K
Monetary intermediation,641,64
Central banking,64110,641
Other monetary intermediation,64190,641
Banks,64191,64190
Building societies,64192,64190
Activities of holding companies,642,64
Activities of holding companies,64200,642
Activities of agricultural holding companies,64201,64200
Activities of production holding companies,64202,64200
Activities of construction holding companies,64203,64200
Activities of distribution holding companies,64204,64200
Activities of financial services holding companies,64205,64200
"Activities of other holding companies (not including agricultural, production, construction, distribution and financial services holding companies) nec",64209,64200
"Trusts, funds and similar financial entities",643,64
"Trusts, funds and similar financial entities",64300,643
Activities of investment trusts,64301,64300
Activities of unit trusts,64302,64300
Activities of venture and development capital companies,64303,64300
Activities of open-ended investment companies,64304,64300
Activities of property unit trusts,64305,64300
Activities of real estate investment trusts,64306,64300
"Other financial service activities, except insurance and pension funding",649,64
Financial leasing,64910,649
Other credit granting,64920,649
Credit granting by non-deposit taking finance houses and other specialist consumer credit grantors,64921,64920
Activities of mortgage finance companies,64922,64920
Other credit granting (not including credit granting by non-deposit taking finance houses and other specialist consumer credit grantors and activities of mortgage finance companies) nec,64929,64920
"Other financial service activities, except insurance and pension funding, nec",64990,649
Security dealing on own account,64991,64990
Factoring,64992,64990
"Other financial service activities, except insurance and pension funding, (not including security dealing on own account and factoring) nec",64999,64990
"Insurance, reinsurance and pension funding, except compulsory social security",65,K
Insurance,651,65
Life insurance,65110,651
Non-life insurance,65120,651
Reinsurance,652,65
Reinsurance,65200,652
Life reinsurance,65201,65200
Non-life reinsurance,65202,65200
Pension funding,653,65
Pension funding,65300,653
Activities auxiliary to financial services and insurance activities,66,K
"Activities auxiliary to financial services, except insurance and pension funding",661,66
Administration of financial markets,66110,661
Security and commodity contracts brokerage,66120,661
"Other activities auxiliary to financial services, except insurance and pension funding",66190,661
Activities auxiliary to insurance and pension funding,662,66
Risk and damage evaluation,66210,662
Activities of insurance agents and brokers,66220,662
Other activities auxiliary to insurance and pension funding,66290,662
Fund management activities,663,66
Fund management activities,66300,663
REAL ESTATE ACTIVITIES,L,Is parent
Real estate activities,68,L
Buying and selling of own real estate,681,68
Buying and selling of own real estate,68100,681
Renting and operating of own or leased real estate,682,68
Renting and operating of own or leased real estate,68200,682
Renting and operating of Housing Association real estate,68201,68200
Letting and operating of conference and exhibition centres,68202,68200
Letting and operating of own or leased real estate (other than Housing Association real estate and conference and exhibition services) nec,68209,68200
Real estate activities on a fee or contract basis,683,68
Real estate agencies,68310,683
Management of real estate on a fee or contract basis,68320,683
"PROFESSIONAL, SCIENTIFIC AND TECHNICAL ACTIVITIES",M,Is parent
Legal and accounting activities,69,M
Legal activities,691,69
Legal activities,69100,691
Barristers at law,69101,69100
Solicitors,69102,69100
Activities of patent and copyright agents; other legal activities (other than those of barristers and solicitors) nec,69109,69100
"Accounting, bookkeeping and auditing activities; tax consultancy",692,69
"Accounting, bookkeeping and auditing activities; tax consultancy",69200,692
"Accounting, and auditing activities",69201,69200
Bookkeeping activities,69202,69200
Tax consultancy,69203,69200
Activities of head offices; management consultancy activities,70,M
Activities of head offices,701,70
Activities of head offices,70100,701
Management consultancy activities,702,70
Public relations and communication activities,70210,702
Business and other management consultancy activities,70220,702
Financial management,70221,70220
Management consultancy activities (other than financial management),70229,70220
