Description,Code,Parent
Architectural and engineering activities; technical testing and analysis,71,M
Architectural and engineering activities and related technical consultancy,711,71
Architectural activities,71110,711
Architectural activities,71111,71110
Urban planning and landscape architectural activities,71112,71110
Engineering activities and related technical consultancy,71120,711
Engineering design activities for industrial process and production,71121,71120
Engineering related scientific and technical consulting activities,71122,71120
Other engineering activities (not including engineering design for industrial process and production or engineering related scientific and technical consulting activities),71129,71120
Technical testing and analysis,712,71
Technical testing and analysis,71200,712
Scientific research and development,72,M
Research and experimental development on natural sciences and engineering,721,72
Research and experimental development on biotechnology,72110,721
Other research and experimental development on natural sciences and engineering,72190,721
Research and experimental development on social sciences and humanities,722,72
Research and experimental development on social sciences and humanities,72200,722
Advertising and market research,73,M
Advertising,731,73
Advertising agencies,73110,731
Media representation,73120,731
Market research and public opinion polling,732,73
Market research and public opinion polling,73200,732
"Other professional, scientific and technical activities",74,M
Specialised design activities,741,74
Specialised design activities,74100,741
Photographic activities,742,74
Photographic activities,74200,742
Portrait photographic activities,74201,74200
Other specialist photography (not including portrait photography),74202,74200
Film processing,74203,74200
Other photographic activities (not including portrait and other specialist photography and film processing) nec,74209,74200
Translation and interpretation activities,743,74
Translation and interpretation activities,74300,743
"Other professional, scientific and technical activities nec",749,74
"Other professional, scientific and technical activities nec",74900,749
Environmental consulting activities,74901,74900
Quantity surveying activities,74902,74900
"Other professional, scientific and technical activities (not including environmental consultancy or quantity surveying) nec",74909,74900
Veterinary activities,75,M
Veterinary activities,750,75
Veterinary activities,75000,750
ADMINISTRATIVE AND SUPPORT SERVICE ACTIVITIES,N,Is parent
Rental and leasing activities,77,N
Renting and leasing of motor vehicles,771,77
Renting and leasing of cars and light motor vehicles,77110,771
Renting and leasing of trucks,77120,771
Renting and leasing of personal and household goods,772,77
Renting and leasing of recreational and sports goods,77210,772
Renting of video tapes and disks,77220,772
Renting and leasing of other personal and household goods,77290,772
Renting and leasing of media entertainment equipment,77291,77290
Renting and leasing of other personal and household goods (other than media entertainment equipment),77299,77290
"Renting and leasing of other machinery, equipment and tangible goods",773,77
Renting and leasing of agricultural machinery and equipment,77310,773
Renting and leasing of construction and civil engineering machinery and equipment,77320,773
Renting and leasing of office machinery and equipment (including computers),77330,773
Renting and leasing of water transport equipment,77340,773
Renting and leasing of passenger water transport equipment,77341,77340
Renting and leasing of freight water transport equipment,77342,77340
Renting and leasing of air transport equipment,77350,773
Renting and leasing of passenger air transport equipment,77351,77350
Renting and leasing of freight air transport equipment,77352,77350
"Renting and leasing of other machinery, equipment and tangible goods nec",77390,773
"Leasing of intellectual property and similar products, except copyrighted works",774,77
"Leasing of intellectual property and similar products, except copyrighted works",77400,774
Employment activities,78,N
Activities of employment placement agencies,781,78
Activities of employment placement agencies,78100,781
"Motion picture, television and other theatrical casting",78101,78100
"Activities of employment placement agencies (other than motion picture, television and other theatrical casting) nec",78109,78100
Temporary employment agency activities,782,78
Temporary employment agency activities,78200,782
Other human resources provision,783,78
Other human resources provision,78300,783
"Travel agency, tour operator and other reservation service and related activities",79,N
Travel agency and tour operator activities,791,79
Travel agency activities,79110,791
Tour operator activities,79120,791
Other reservation service and related activities,799,79
Other reservation service and related activities,79900,799
Activities of tourist guides,79901,79900
Other reservation service and related activities (not including activities of tourist guides),79909,79900
Security and investigation activities,80,N
Private security activities,801,80
Private security activities,80100,801
Security systems service activities,802,80
Security systems service activities,80200,802
Investigation activities,803,80
Investigation activities,80300,803
Services to buildings and landscape activities,81,N
Combined facilities support activities,811,81
Combined facilities support activities,81100,811
Cleaning activities,812,81
General cleaning of buildings,81210,812
Other building and industrial cleaning activities,81220,812
Window cleaning services,81221,81220
Specialised cleaning services,81222,81220
Furnace and chimney cleaning services,81223,81220
"Building and industrial cleaning activities (other than window cleaning, specialised cleaning and furnace and chimney cleaning services) nec",81229,81220
Other cleaning activities,81290,812
Disinfecting and extermination services,81291,81290
Cleaning services (other than disinfecting and extermination services) nec,81299,81290
Landscape service activities,813,81
Landscape service activities,81300,813
"Office administrative, office support and other business support activities",82,N
Office administrative and support activities,821,82
Combined office administrative service activities,82110,821
"Photocopying, document preparation and other specialised office support activities",82190,821
Activities of call centres,822,82
Activities of call centres,82200,822
Organisation of conventions and trade shows,823,82
Organisation of conventions and trade shows,82300,823
Activities of exhibition and fair organizers,82301,82300
Activities of conference organizers,82302,82300
Business support service activities nec,829,82
Activities of collection agencies and credit bureaus,82910,829
Activities of collection agencies,82911,82910
Activities of credit bureaus,82922,82920
Packaging activities,82920,829
Other business support service activities nec,82990,829
PUBLIC ADMINISTRATION AND DEFENCE; COMPULSORY SOCIAL SECURITY,O,Is parent
Public administration and defence; compulsory social security,84,O
Administration of the State and the economic and social policy of the community,841,84
General public administration activities,84110,841
"Regulation of the activities of providing health care, education, cultural services and other social services, excluding social security",84120,841
Regulation of and contribution to more efficient operation of businesses,84130,841
Provision of services to the community as a whole,842,84
Foreign affairs,84210,842
Defence activities,84220,842
Justice and judicial activities,84230,842
Public order and safety activities,84240,842
Fire service activities,84250,842
Compulsory social security activities,843,84
Compulsory social security activities,84300,843
EDUCATION,P,Is parent
Education,85,P
Pre-primary education,851,85
Pre-primary education,85100,851
Primary education,852,85
Primary education,85200,852
Secondary education,853,85
General secondary education,85310,853
Technical and vocational secondary education,85320,853
Higher education,854,85
Post-secondary non-tertiary education,85410,854
Tertiary education,85420,854
First-degree level higher education,85421,85420
Post-graduate level higher education,85422,85420
Other education,855,85
Sports and recreation education,85510,855
Cultural education,85520,855
Driving school activities,85530,855
Other education nec,85590,855
Educational support activities,856,85
Educational support activities,85600,856
HUMAN HEALTH AND SOCIAL WORK ACTIVITIES,Q,Is parent
Human health activities,86,Q
Hospital activities,861,86
Hospital activities,86100,861
Hospital activities,86101,86100
Medical nursing home activities,86102,86100
Medical and dental practice activities,862,86
General medical practice activities,86210,862
Specialist medical practice activities,86220,862
Dental practice activities,86230,862
Other human health activities,869,86
Other human health activities,86900,869
Residential care activities,87,Q
Residential nursing care activities,871,87
Residential nursing care activities,87100,871
"Residential care activities for learning disabilities, mental health and substance abuse",872,87
"Residential care activities for learning disabilities, mental health and substance abuse",87200,872
Residential care activities for the elderly and disabled,873,87
Residential care activities for the elderly and disabled,87300,873
Other residential care activities,879,87
Other residential care activities,87900,879
Social work activities without accommodation,88,Q
Social work activities without accommodation for the elderly and disabled,881,88
Social work activities without accommodation for the elderly and disabled,88100,881
Other social work activities without accommodation,889,88
Child day-care activities,88910,889
Other social work activities without accommodation nec,88990,889
"ARTS, ENTERTAINMENT AND RECREATION",R,Is parent
"Creative, arts and entertainment activities",90,R
"Creative, arts and entertainment activities",900,90
Performing arts,90010,900
Support activities to performing arts,90020,900
Artistic creation,90030,900
Operation of arts facilities,90040,900
"Libraries, archives, museums and other cultural activities",91,R
"Libraries, archives, museums and other cultural activities",910,91
Library and archive activities,91010,910
Library activities,91011,91010
Archive activities,91012,91010
Museum activities,91020,910
Operation of historical sites and buildings and similar visitor attractions,91030,910
Botanical and zoological gardens and nature reserve activities,91040,910
Gambling and betting activities,92,R
Gambling and betting activities,920,92
Gambling and betting activities,92000,920
Sports activities and amusement and recreation activities,93,R
Sports activities,931,93
Operation of sports facilities,93110,931
Activities of sport clubs,93120,931
Fitness facilities,93130,931
Other sports activities,93190,931
Activities of racehorse owners,93191,93190
Other sports activities (not including activities of racehorse owners) nec,93199,93190
Amusement and recreation activities,932,93
Activities of amusement parks and theme parks,93210,932
Other amusement and recreation activities,93290,932
OTHER SERVICE ACTIVITIES,S,Is parent
Activities of membership organisations,94,S
"Activities of business, employers and professional membership organisations",941,94
Activities of business and employers membership organisations,94110,941
Activities of professional membership organisations,94120,941
Activities of trade unions,942,94
Activities of trade unions,94200,942
Activities of other membership organisations,949,94
Activities of religious organisations,94910,949
Activities of political organisations,94920,949
Activities of other membership organisations nec,94990,949
Repair of computers and personal and household goods,95,S
Repair of computers and communication equipment,951,95
Repair of computers and peripheral equipment,95110,951
Repair of communication equipment,95120,951
Repair of personal and household goods,952,95
Repair of consumer electronics,95210,952
Repair of household appliances and home and garden equipment,95220,952
Repair of footwear and leather goods,95230,952
Repair of furniture and home furnishings,95240,952
"Repair of watches, clocks and jewellery",95250,952
Repair of other personal and household goods,95290,952
Other personal service activities,96,S
Other personal service activities,960,96
Washing and (dry-)cleaning of textile and fur products,96010,960
Hairdressing and other beauty treatment,96020,960
Funeral and related activities,96030,960
Physical well-being activities,96040,960
Other personal service activities nec,96090,960
ACTIVITIES OF HOUSEHOLDS AS EMPLOYERS; UNDIFFERENTIATED GOODS-AND SERVICES-PRODUCING ACTIVITIES OF HOUSEHOLDS FOR OWN USE,T,Is parent
Activities of households as employers of domestic personnel,97,T
Activities of households as employers of domestic personnel,970,97
Activities of households as employers of domestic personnel,97000,970
Undifferentiated goods- and services-producing activities of private households for own use,98,T
Undifferentiated goods-producing activities of private households for own use,981,98
Undifferentiated goods-producing activities of private households for own use,98100,981
Undifferentiated service-producing activities of private households for own use,982,98
Undifferentiated service-producing activities of private households for own use,98200,982
ACTIVITIES OF EXTRATERRITORIAL ORGANISATIONS AND BODIES,U,Is parent
Activities of extraterritorial organisations and bodies,99,U
Activities of extraterritorial organisations and bodies,990,99
Activities of extraterritorial organisations and bodies,99000,990