label,altLabel,description,parent_organisations,hasRegisteredSite,hasPrimarySite
South East England Virtual Education Action Zone,SMCP Commission,"Education Action Zones were partnerships of schools and other local interests, including business, which had the autonomy and flexibility to harness partners’ expertise and develop innovative educational strategies for the benefit of schools and local communities.",,https://www.gov.uk/government/organisations/south-east-england-virtual-education-action-zone,
South East Sheffield Education Action Zone,SMCP Commission,"Education Action Zones were partnerships of schools and other local interests, including business, which had the autonomy and flexibility to harness partners’ expertise and develop innovative educational strategies for the benefit of schools and local communities.",,https://www.gov.uk/government/organisations/south-east-sheffield-education-action-zone,
South Eastern Education and Library Board,SMCP Commission,"South Eastern Education and Library Board is the local authority for education, library and youth services in the district council areas of Ards, Castlereagh, Down, Lisburn and North Down in Northern Ireland.",,https://www.gov.uk/government/organisations/south-eastern-education-and-library-board,
South West of England Regional Development Agency,SMCP Commission,SWRDA was responsible for leading and developing sustainable growth in the south west. It was abolished in 2012.,,https://www.gov.uk/government/organisations/south-west-of-england-regional-development-agency,
Southend Education Action Zone,SMCP Commission,"Education Action Zones were partnerships of schools and other local interests, including business, which had the autonomy and flexibility to harness partners’ expertise and develop innovative educational strategies for the benefit of schools and local communities.",,https://www.gov.uk/government/organisations/southend-education-action-zone,
Southern Health and Social Services Board,SMCP Commission,"The Southern Health and Social Care Trust provides health and social care services across the five council areas of Armagh, Banbridge, Craigavon, Dungannon, and Newry and Mourne.",,https://www.gov.uk/government/organisations/southern-health-and-social-services-board,
Special EU Programmes Body,SMCP Commission,"The Special EU Programmes Body manages cross-border European Union Structural Funds programmes in Northern Ireland, the Border Region of Ireland and parts of Western Scotland, and in the UK is accountable to the Northern Ireland Executive.",,https://www.gov.uk/government/organisations/special-eu-programmes-body,
Speke Garston Education Action Zone,SMCP Commission,"Education Action Zones were partnerships of schools and other local interests, including business, which had the autonomy and flexibility to harness partners’ expertise and develop innovative educational strategies for the benefit of schools and local communities.",,https://www.gov.uk/government/organisations/speke-garston-education-action-zone,
Staff Commission for Education and Library Boards,SMCP Commission,"The Staff Commission for Education and Library Boards is an Executive Non-Departmental Public Body (NDPB) whose aim is to oversee recruitment, promotion, training and terms and conditions of employment for non-teaching staff employed in Education and Library Boards in Northern Ireland.",,https://www.gov.uk/government/organisations/staff-commission-for-education-and-library-boards,
Standards Board for England,SMCP Commission,"The Standards Board for England, branded as Standards for England, was a non-departmental public body sponsored by the Department for Communities and Local Government.",,https://www.gov.uk/government/organisations/standards-board-for-england,
State Veterinary Service,SMCP Commission,The State Veterinary Service was the government body responsible for animal health and welfare. In 2007 it became a part of Animal Health.,,https://www.gov.uk/government/organisations/state-veterinary-service,
Statistics Commission,SMCP Commission,"The Statistics Commission was a non-departmental public body established in June 2000 to oversee the work of the Office for National Statistics. Following the introduction of the Statistics and Registration Services Act 2007, the Commission was replaced by the UK Statistics Authority.",,https://www.gov.uk/government/organisations/statistics-commission,
Stoke Education Action Zone,SMCP Commission,"Education Action Zones were partnerships of schools and other local interests, including business, which had the autonomy and flexibility to harness partners’ expertise and develop innovative educational strategies for the benefit of schools and local communities.",,https://www.gov.uk/government/organisations/stoke-education-action-zone,
Strategic Rail Authority,SMCP Commission,Strategic Rail Authority (SRA) was a non-departmental public body in the United Kingdom set up under the Transport Act 2000 to provide strategic direction for the railway industry.,,https://www.gov.uk/government/organisations/strategic-rail-authority,
Sunderland Education Action Zone,SMCP Commission,"Education Action Zones were partnerships of schools and other local interests, including business, which had the autonomy and flexibility to harness partners’ expertise and develop innovative educational strategies for the benefit of schools and local communities.",,https://www.gov.uk/government/organisations/sunderland-education-action-zone,
Surveillance Camera Commissioner,SCC,The role of the Surveillance Camera Commissioner is to encourage compliance with the surveillance camera code of practice.,https://www.gov.uk/government/organisations/home-office,https://www.gov.uk/government/organisations/surveillance-camera-commissioner,
Sutherland Inquiry,SCC,The inquiry was setup to review the circumstances surrounding the delay to the marking of National Curriculum tests in 2008.,,https://www.gov.uk/government/organisations/sutherland-inquiry,
Technology Strategy Board,SCC,The Technology Strategy Board supported the development of innovative technologies and products.,https://www.gov.uk/government/organisations/department-for-business-innovation-skills,https://www.gov.uk/government/organisations/technology-strategy-board,
Telford and Wrekin Education Action Zone,SCC,"Education Action Zones were partnerships of schools and other local interests, including business, which had the autonomy and flexibility to harness partners’ expertise and develop innovative educational strategies for the benefit of schools and local communities.",,https://www.gov.uk/government/organisations/telford-and-wrekin-education-action-zone,
Tenant Services Authority,SCC,"The Tenant Services Authority (TSA) was the operating name of the Office for Tenants and Social Landlords, the former regulatory agency of registered providers of social housing in England. TSA’s responsibilities passed to the Homes and Communities Agency in 2012.",,https://www.gov.uk/government/organisations/tenant-services-authority,
The Food and Environment Research Agency,Fera,"On 1 April 2015 the business and operations of the Food and Environment Research Agency (Fera), an Executive Agency of Defra, transferred to Fera Science Limited (FSL), a Joint Venture (JV) between Defra and Capita. Their website is at www.fera.co.uk . The Plant Health Inspectorate, Plant Varieties and Seeds, the National Bee Unit and the GM Inspectorate are now part of the Animal and Plant Health Agency .",https://www.gov.uk/government/organisations/department-for-environment-food-rural-affairs,https://www.gov.uk/government/organisations/the-food-and-environment-research-agency,
The Jeffrey Review,Fera,The Jeffrey Review was an independent review looking into how criminal defendants are given independent legal representation in the courts of England and Wales.,https://www.gov.uk/government/organisations/ministry-of-justice,https://www.gov.uk/government/organisations/jeffrey-review,
The McKay Commission,TMC,"The McKay Commission (TMC) was set up to consider how the House of Commons might deal with legislation which affects only part of the UK, following the devolution of certain legislative powers to Scotland, Northern Ireland and Wales. View the archived McKay Commission site. Following the outcome of the Scottish Independence Referendum, read about the government’s next steps for devolving powers .",https://www.gov.uk/government/organisations/cabinet-office,https://www.gov.uk/government/organisations/mckay-commission,
The Pensions Advisory Service,TPAS,"The Pensions Advisory Service (TPAS) gave information and guidance to members of the public on state, company and personal pensions. It helped any member of the public who had a problem with their occupational or private pension arrangement.",https://www.gov.uk/government/organisations/department-for-work-pensions,https://www.gov.uk/government/organisations/the-pensions-advisory-service,
The Shareholder Executive,ShEx,The Shareholder Executive (ShEx) managed the government’s shareholder relationships with businesses owned or part-owned by the government. In April 2016 the Shareholder Executive was brought together with UK Financial Investments (UKFI) under a single holding company – UK Government Investments (UKGI). This is part of the government’s plan to deliver a centre of corporate finance and governance expertise for government.,https://www.gov.uk/government/organisations/department-for-business-innovation-skills,https://www.gov.uk/government/organisations/the-shareholder-executive,
Third Party Campaigning Review,Third Party Campaigning Review,"We are an independent review, looking at the 2015 general election to see how well the regulatory system for third party campaigning works.",https://www.gov.uk/government/organisations/cabinet-office,https://www.gov.uk/government/organisations/third-party-campaigning-review,
Thurrock Thames Gateway Development Corporation,Third Party Campaigning Review,The corporation was setup in 2003 with the aim of regenerating Thurrock. It was abolished in 2012.,,https://www.gov.uk/government/organisations/thurrock-thames-gateway-development-corporation,
Trade Remedies Investigations Directorate,TRID,,https://www.gov.uk/government/organisations/department-for-international-trade,https://www.gov.uk/government/organisations/trade-remedies-investigations-directorate,
Training and Development Agency for Schools,TDA,The Training and Development Agency for Schools (TDA) was a body responsible for the initial and in-service training of teachers and other school staff in England.,,https://www.gov.uk/government/organisations/training-and-development-agency-for-schools,
Treasury Solicitor’s Department,TSol,The Treasury Solicitor’s Department (TSol) was a non-ministerial government department that provided legal services to the majority of central government departments and often represented government departments and other publicly funded bodies in England and Wales. On 1 April 2015 TSol became the Government Legal Department (GLD).,https://www.gov.uk/government/organisations/attorney-generals-office,https://www.gov.uk/government/organisations/treasury-solicitor-s-department,
Trust ports,TP,"Trust ports (TP) are independent statutory bodies, each governed by their own, unique, statutes and controlled by a local independent board. There are no shareholders or owners and any surplus is ploughed back into each port for the benefit of its stakeholders. There are over 100 trust ports in the UK. The Secretary of State for Transport retains responsibility for appointing chairs and non-executive members to the boards of the small number of ports considered to be nationally significant.",https://www.gov.uk/government/organisations/department-for-transport,https://www.gov.uk/government/organisations/trust-ports,
UK Border Agency,UKBA,"UK Visas and Immigration now manages applications for people who want to visit, work, study or settle in the UK. Previously, this was part of UKBA (UK Border Agency) which closed in 2013.",https://www.gov.uk/government/organisations/home-office,https://www.gov.uk/government/organisations/uk-border-agency,
UK Co-ordinating Body,UKCB,"We’re a unit located within core-Defra that supports Defra and the Scottish, Welsh and Northern Ireland governments and their paying agencies to administer the Common Agricultural Policy (CAP) in the UK in accordance with the UK’s Withdrawal Agreement with the EU.",https://www.gov.uk/government/organisations/department-for-environment-food-rural-affairs,https://www.gov.uk/government/organisations/uk-co-ordinating-body,
UK Commission for Employment and Skills,UKCES,"We are a publicly funded, industry-led organisation that offers guidance on skills and employment issues in the UK.",https://www.gov.uk/government/organisations/department-for-education,https://www.gov.uk/government/organisations/uk-commission-for-employment-and-skills,
UK Film Council,UKCES,The Film Council was set up in 2000 to promote the UK film industry. It was abolished in 2011.,,https://www.gov.uk/government/organisations/uk-film-council,
UK Financial Investments Limited,UKFI,"UK Financial Investments Limited (UKFI) manages the government’s investments in the Royal Bank of Scotland (RBS), Lloyds Banking Group (Lloyds) and UK Asset Resolution Ltd (UKAR). UKFI is a company with HM Treasury as its sole shareholder and operates at arm’s length from government.",https://www.gov.uk/government/organisations/hm-treasury,https://www.gov.uk/government/organisations/uk-financial-investments-limited,
UK Government Decontamination Service,UKFI,,https://www.gov.uk/government/organisations/the-food-and-environment-research-agency,https://www.gov.uk/government/organisations/uk-government-decontamination-service,
UK Green Investment Bank,GIB,"The UK Green Investment Bank (now the Green Investment Group) was a non-departmental public body of BEIS, but is now an independent organisation owned by Macquarie Group Limited. www.greeninvestmentbank.com",https://www.gov.uk/government/organisations/department-for-business-energy-and-industrial-strategy,https://www.gov.uk/government/organisations/uk-green-investment-bank,
UK Passport Service,GIB,"The UK Passport Service was merged with the Home Office’s Identity Cards programme to form the Identity and Passport Service, now operating as Her Majesty’s Passport Office.",,https://www.gov.uk/government/organisations/uk-passport-service,
UK Trade & Investment,UKTI,We drive the government’s policy of increasing the number of exporters and inward investors to the UK.,,https://www.gov.uk/government/organisations/uk-trade-investment,
UK Transplant,UKTI,NHS Blood and Transplant (NHSBT) is a special health authority of the English National Health Service (NHS).,,https://www.gov.uk/government/organisations/uk-transplant,
UKTI Education,UKTI Education,"UKTI Education closed in July 2016. UKTI Education was part of Department for Business, Innovation & Skills (BIS) and UK Trade & Investment (UKTI). UKTI Education helped UK education and training organisations win business overseas. They identified high value commercial education opportunities and then work with the UK education and training sector to prepare effective, co-ordinated UK responses.",https://www.gov.uk/government/organisations/department-for-business-innovation-skills,https://www.gov.uk/government/organisations/ukti-education,
UKTI Life Sciences Organisation,UKTI LSO,"We help UK life science companies to do business overseas and encourage foreign life science companies to invest in the UK. We provide support from the earliest stages of research and development through to clinical trials, commercial operations and business partnerships.",https://www.gov.uk/government/organisations/uk-trade-investment,https://www.gov.uk/government/organisations/ukti-life-sciences-organisation,
United Kingdom Blood Transfusion Services,UKTI LSO,The UKBTS is run by the Joint Professional Advisory Committee and is responsible for the dissemination of guidance and best practice on blood transfusion.,,https://www.gov.uk/government/organisations/united-kingdom-blood-transfusion-services,
Valuation and Lands Agency,UKTI LSO,The Agency was responsible for valuing properties subject to rates in Northern Ireland. It is now a part of the Land and Property Services agency.,,https://www.gov.uk/government/organisations/valuation-and-lands-agency,
Varney Review,UKTI LSO,The review by Sir David Varney was setup to look at the way government used technology to deliver services to the public.,,https://www.gov.uk/government/organisations/varney-review,
Vehicle and Operator Services Agency,VOSA,"The Vehicle and Operator Services Agency ( VOSA ) has closed. It’s been replaced by the Driver and Vehicle Standards Agency ( DVSA ). DVSA services and information These services are now provided by DVSA : MOT and vehicle testing vehicle approval check for vehicle, part or accessory recalls report a lorry, bus or coach driver or company You can also use other services and information from DVSA . Contact DVSA if you needed to contact VOSA . Vehicle operator licences These services are now provided by the Traffic Commissioners for Great Britain : apply for a vehicle operator licence manage your vehicle operator licence check vehicle operator licence applications find lorry or bus operators HGV applications and decisions PSV notices and proceedings View all vehicle operator licence services and information . History of VOSA VOSA was an executive agency, sponsored by the Department for Transport . It existed from 3 April 2003 to 31 March 2014. VOSA merged with the Driving Standards Agency (DSA) to create DVSA .",https://www.gov.uk/government/organisations/department-for-transport,https://www.gov.uk/government/organisations/vehicle-and-operator-services-agency,
Veterinary Laboratories Agency,VOSA,"The Agency carried out animal disease surveillance, diagnostic services and veterinary scientific research for government and commercial organisations. It was merged with Animal Health in 2011 to form the Animal Health and Veterinary Laboratories Agency.",,https://www.gov.uk/government/organisations/veterinary-laboratories-agency,
Veterinary Residues Committee,VRC,The Veterinary Residues Committee is an independent scientific advisory committee that advises government on the testing of foods from animals to look for residues of veterinary medicines and banned substances.,https://www.gov.uk/government/organisations/department-for-environment-food-rural-affairs,https://www.gov.uk/government/organisations/veterinary-residues-committee,
Victims' Advisory Panel,VAP,The Victims’ Advisory Panel (VAP) is for victims of crime and their families to have a say in the reform of the Criminal Justice System.,https://www.gov.uk/government/organisations/ministry-of-justice,https://www.gov.uk/government/organisations/victim-s-advisory-panel,
Victoria Climbié Inquiry,VAP,The inquiry was established to investigate the circumstances surrounding the death of Victoria Climbié in 2000.,,https://www.gov.uk/government/organisations/victoria-climbi_-inquiry,
Wakefield Education Action Zone,VAP,"Education Action Zones were partnerships of schools and other local interests, including business, which had the autonomy and flexibility to harness partners’ expertise and develop innovative educational strategies for the benefit of schools and local communities.",,https://www.gov.uk/government/organisations/wakefield-education-action-zone,
Warship Support Agency,VAP,The Warship Support Agency (WSA) was a non-executive agency within the Defence Logistics Organisation (DLO) of the UK Ministry of Defence.,,https://www.gov.uk/government/organisations/warship-support-agency,
Water Service (Northern Ireland),VAP,Water Service is an Executive Agency within the Department for Regional Development. The Department has statutory responsibility for the provision of water and sewerage services under the Water and Sewerage Services (Northern Ireland) Order 1973. The Water Service on behalf of the Department exercises these responsibilities.,,https://www.gov.uk/government/organisations/water-service-northern-ireland,
Waterways Ireland,VAP,"Waterways Ireland was established under the Belfast Agreement in 1999. It is responsible for the management, maintenance, development, and restoration of inland navigable waterways primarily for recreational purposes.",,https://www.gov.uk/government/organisations/waterways-ireland,
Wave Hub,VAP,"Wave Hub is a testing facility for wave energy devices, located off the north coast of Cornwall. It is publicly owned by Cornwall Council with a stand-alone operating company, Wave Hub Limited, to manage the operation of the facility on its behalf. Wave Hub has a separate website: http://www.wavehub.co.uk/",,https://www.gov.uk/government/organisations/wave-hub,
Wednesbury Education Action Zone,VAP,"Education Action Zones were partnerships of schools and other local interests, including business, which had the autonomy and flexibility to harness partners’ expertise and develop innovative educational strategies for the benefit of schools and local communities.",,https://www.gov.uk/government/organisations/wednesbury-education-action-zone,
Welsh Development Agency,VAP,"The WDA was responsible for encouraging business development and investment in Wales, clearing derelict land and encouraging growth of local businesses. It was abolished in 2006.",,https://www.gov.uk/government/organisations/welsh-development-agency,
Welsh Office,VAP,The Welsh Office now operates as the Wales Office,,https://www.gov.uk/government/organisations/welsh-office,
West Northamptonshire Development Corporation,WNDC,"The West Northamptonshire Development Corporation (WNDC) was set up by the government in 2004 to encourage and provide new jobs, investment and homes for rent or sale in the three towns of Northampton, Daventry and Towcester.",https://www.gov.uk/government/organisations/ministry-of-housing-communities-and-local-government,https://www.gov.uk/government/organisations/the-west-northamptonshire-development-corporation,
Western Education and Library Board,WNDC,"The Western Education and Library Board is the local authority for the provision of education, library and youth services in the District council areas of Derry, Fermanagh, Limavady, Omagh and Strabane.",,https://www.gov.uk/government/organisations/western-education-and-library-board,
Western Health and Social Services Board,WNDC,Western Health and Social Services Board is no longer part of UK central government. Its role is now covered by the Northern Ireland Health and Social Care Board .,,https://www.gov.uk/government/organisations/western-health-and-social-services-board,
Westminster Education Action Zone,WNDC,"Education Action Zones were partnerships of schools and other local interests, including business, which had the autonomy and flexibility to harness partners’ expertise and develop innovative educational strategies for the benefit of schools and local communities.",,https://www.gov.uk/government/organisations/westminster-education-action-zone,
Withernsea and Southern Holderness Education Action Zone,WNDC,"Education Action Zones were partnerships of schools and other local interests, including business, which had the autonomy and flexibility to harness partners’ expertise and develop innovative educational strategies for the benefit of schools and local communities.",,https://www.gov.uk/government/organisations/withernsea-and-southern-holderness-education-action-zone,
Wolverhampton Education Action Zone,WNDC,"Education Action Zones were partnerships of schools and other local interests, including business, which had the autonomy and flexibility to harness partners’ expertise and develop innovative educational strategies for the benefit of schools and local communities.",,https://www.gov.uk/government/organisations/wolverhampton-education-action-zone,
Working Ventures UK,WNDC,Working Ventures UK was an employer-led organisation which advises the Government on labour market policies and performance. Its principle objective was to help disadvantaged people move from poverty into jobs that contribute to business productivity and growth. WVUK ceased operations in 2009.,,https://www.gov.uk/government/organisations/working-ventures-uk,
Wythenshawe Education Action Zone,WNDC,"Education Action Zones were partnerships of schools and other local interests, including business, which had the autonomy and flexibility to harness partners’ expertise and develop innovative educational strategies for the benefit of schools and local communities.",,https://www.gov.uk/government/organisations/wythenshawe-education-action-zone,
Yorkshire Forward,WNDC,Yorkshire Forward was the regional development agency for the Yorkshire and the Humber region. It was abolished in 2012.,,https://www.gov.uk/government/organisations/yorkshire-forward,
Young People's Learning Agency,YPLA,The Young People’s Learning Agency was responsible for funding further education for 16-19 year olds in England. It was abolished in 2012 with responsibilities transferring to the Education Funding Agency.,,https://www.gov.uk/government/organisations/young-peoples-learning-agency,
Zahid Mubarek Inquiry,YPLA,The inquiry was setup to investigate the circumstances surrounding the murder of Zahid Mubarek at Feltham Young Offenders Institute in 2000.,,https://www.gov.uk/government/organisations/zahid-mubarek-inquiry,
