label,altLabel,description,parent_organisations,hasRegisteredSite,hasPrimarySite
Low Pay Commission,LPC,"The Low Pay Commission is an independent body that advises the government about the National Living Wage and the National Minimum Wage. LPC is an advisory non-departmental public body, sponsored by the Department for Business, Energy & Industrial Strategy .",https://www.gov.uk/government/organisations/department-for-business-energy-and-industrial-strategy,https://www.gov.uk/government/organisations/low-pay-commission,
Magnox Ltd,LPC,We are responsible for the safe and secure clean-up of 12 nuclear sites and operation of one hydro-electric plant. Magnox Ltd works with the Nuclear Decommissioning Authority .,https://www.gov.uk/government/organisations/nuclear-decommissioning-authority,https://www.gov.uk/government/organisations/magnox-ltd,
Marine Accident Investigation Branch,MAIB,The MAIB investigates marine accidents involving UK vessels worldwide and all vessels in UK territorial waters. MAIB works with the Department for Transport .,https://www.gov.uk/government/organisations/department-for-transport,https://www.gov.uk/government/organisations/marine-accident-investigation-branch,
Maritime and Coastguard Agency,MCA,"We work to prevent the loss of life on the coast and at sea. We produce legislation and guidance on maritime matters, and provide certification to seafarers. MCA is an executive agency, sponsored by the Department for Transport .",https://www.gov.uk/government/organisations/department-for-transport,https://www.gov.uk/government/organisations/maritime-and-coastguard-agency,
Marshall Aid Commemoration Commission,MACC,"The Marshall Aid Commemoration Commission (MACC) administers the British Marshall Scholarships, which finance young Americans of high ability to study for a graduate degree in the UK. MACC is an executive non-departmental public body, sponsored by the Foreign, Commonwealth & Development Office .",https://www.gov.uk/government/organisations/foreign-commonwealth-development-office,https://www.gov.uk/government/organisations/marshall-aid-commemoration-commission,
Medical Profession,MACC,The Medical Profession brings together doctors from across the Civil Service. Medical Profession is part of the Civil Service .,https://www.gov.uk/government/organisations/civil-service,https://www.gov.uk/government/organisations/civil-service-medical-profession,
Medical Research Council,MRC,"The Medical Research Council (MRC) is a national funding agency dedicated to improving human health by supporting research across the entire spectrum of medical sciences, in universities and hospitals, in MRC units, centres and institutes in the UK, and in MRC units in Africa. MRC works with the UK Research and Innovation .",https://www.gov.uk/government/organisations/uk-research-and-innovation,https://www.gov.uk/government/organisations/medical-research-council,
Medicines and Healthcare products Regulatory Agency,MHRA,"The Medicines and Healthcare products Regulatory Agency regulates medicines, medical devices and blood components for transfusion in the UK. MHRA is an executive agency, sponsored by the Department of Health and Social Care .",https://www.gov.uk/government/organisations/department-of-health-and-social-care,https://www.gov.uk/government/organisations/medicines-and-healthcare-products-regulatory-agency,
Migration Advisory Committee,MAC,"The Migration Advisory Committee (MAC) is an independent, non-statutory, non-time limited, non-departmental public body that advises the government on migration issues. MAC is an advisory non-departmental public body, sponsored by the Home Office .",https://www.gov.uk/government/organisations/home-office,https://www.gov.uk/government/organisations/migration-advisory-committee,
Military Aviation Authority,MAA,"The Military Aviation Authority is responsible for the regulation, assurance and enforcement of the defence air operating and technical domains. MAA is part of the Ministry of Defence and the Defence Safety Authority .",https://www.gov.uk/government/organisations/ministry-of-defence,https://www.gov.uk/government/organisations/military-aviation-authority,
Ministry of Defence,MOD,"We work for a secure and prosperous United Kingdom with global reach and influence. We will protect our people, territories, values and interests at home and overseas, through strong armed forces and in partnership with allies, to ensure our security, support our national interests and safeguard our prosperity. MOD is a ministerial department, supported by 25 agencies and public bodies .",,https://www.gov.uk/government/organisations/ministry-of-defence,
Modernisation and Reform,MOJ,We are committed to working towards the common purpose of reforming government and modernising the Civil Service to better deliver for the public. Modernisation and Reform is part of the Cabinet Office .,https://www.gov.uk/government/organisations/cabinet-office,https://www.gov.uk/government/organisations/modernisation-and-reform,
Money and Pensions Service,MaPS,"The Money and Pensions Service (MaPS) replaces the 3 existing providers of government-sponsored financial guidance – the Money Advice Service, the Pensions Advisory Service and Pension Wise. It provides free and impartial debt advice, money guidance and pension guidance to members of the public. The organisation was set up as the Single Financial Guidance Body (SFGB) on 1 October 2018. It was renamed the Money and Pensions Service (MaPS) in April 2019. MaPS is an executive non-departmental public body, sponsored by the Department for Work and Pensions .",https://www.gov.uk/government/organisations/department-for-work-pensions,https://www.gov.uk/government/organisations/single-financial-guidance-body,
National Army Museum,NAM,"The National Army Museum (NAM) is the leading authority on the history of the British Army. It gathers, maintains and makes known the story of the British Army and its role and impact in world history. NAM is an executive non-departmental public body, sponsored by the Ministry of Defence .",https://www.gov.uk/government/organisations/ministry-of-defence,https://www.gov.uk/government/organisations/national-army-museum,
National Citizen Service,NCS,"NCS works with the Department for Digital, Culture, Media & Sport .",https://www.gov.uk/government/organisations/department-for-digital-culture-media-sport,https://www.gov.uk/government/organisations/national-citizen-service,
National Counter Terrorism Security Office,NaCTSO,The National Counter Terrorism Security Office (NaCTSO) is a police hosted unit that supports the ‘protect and prepare’ strands of the government’s counter terrorism strategy. NaCTSO works with the Home Office .,https://www.gov.uk/government/organisations/home-office,https://www.gov.uk/government/organisations/national-counter-terrorism-security-office,
National Crime Agency,NCA,"The National Crime Agency, also known as the NCA, is a crime-fighting law enforcement agency responsible for leading the UK’s fight to cut serious and organised crime.",,https://www.gov.uk/government/organisations/national-crime-agency,
National Crime Agency Remuneration Review Body ,NCARRB,The National Crime Agency Remuneration Review Body (NCARRB) make independent recommendations to the government on the pay and allowances of National Crime Agency (NCA) officers designated with operational powers. These officers are subject to legislative restrictions on industrial action. The NCA was established by the Crime and Courts Act 2013 and became operational on 7 October 2013. The NCARRB was established under the National Crime Agency (Remuneration Review Body) Regulations which came into force on 29 August 2013. Members of the NCARRB are also members of the Police Remuneration Review Body (PPRB). NCARRB works with the Home Office .,https://www.gov.uk/government/organisations/home-office,https://www.gov.uk/government/organisations/national-crime-agency-remuneration-review-body,
National Cyber Force,NCF,"The National Cyber Force (NCF) is a partnership between defence and intelligence. NCF is part of the Ministry of Defence , the Defence Science and Technology Laboratory , the Secret Intelligence Service , and the Government Communications Headquarters .",https://www.gov.uk/government/organisations/ministry-of-defence,https://www.gov.uk/government/organisations/national-cyber-force,
National Cyber Security Centre,NCSC,"The NCSC acts as a bridge between industry and government, providing a unified source of advice, guidance and support on cyber security, including the management of cyber security incidents. NCSC is part of the Government Communications Headquarters .",https://www.gov.uk/government/organisations/government-communications-headquarters,https://www.gov.uk/government/organisations/national-cyber-security-centre,
National Data Guardian,NDG,The National Data Guardian (NDG) advises and challenges the health and care system to help ensure that citizens’ confidential information is safeguarded securely and used properly. NDG works with the Department of Health and Social Care .,https://www.gov.uk/government/organisations/department-of-health-and-social-care,https://www.gov.uk/government/organisations/national-data-guardian,
National Employment Savings Trust (NEST) Corporation,NEST Corporation,"The National Employment Savings Trust (NEST) Corporation is the trustee of the NEST occupational pension scheme. The scheme, which is run on a not-for-profit basis, ensures that all employers have access to suitable, low-charge pension provision to meet their new duty to enrol all eligible workers into a workplace pension automatically. NEST Corporation is a public corporation of the Department for Work and Pensions .",https://www.gov.uk/government/organisations/department-for-work-pensions,https://www.gov.uk/government/organisations/national-employment-savings-trust,
National Forest Company,NFC,"The National Forest Company leads the creation of The National Forest, a new, forested landscape and destination across 200 square miles of central England. Forest cover (woods and other habitats) has trebled to almost 20% and alongside a transformed environment the economic and social well-being of the area continue to grow. NFC is an executive non-departmental public body, sponsored by the Department for Environment, Food & Rural Affairs .",https://www.gov.uk/government/organisations/department-for-environment-food-rural-affairs,https://www.gov.uk/government/organisations/national-forest-company,
National Gallery,NFC,"The National Gallery houses the national collection of Western European painting from the 13th to 19th centuries. It cares for the collection, enhancing it for future generations, primarily by acquisition, and also studies it whilst encouraging access to the pictures for the education and enjoyment of the widest possible public. National Gallery is an executive non-departmental public body, sponsored by the Department for Digital, Culture, Media & Sport .",https://www.gov.uk/government/organisations/department-for-digital-culture-media-sport,https://www.gov.uk/government/organisations/national-gallery,
National Heritage Memorial Fund,NHMF,"The National Heritage Memorial Fund (NHMF) saves the most outstanding parts of our heritage at risk of loss to the nation, as a memorial to those who have given their lives for the UK. NHMF is an executive non-departmental public body, sponsored by the Department for Digital, Culture, Media & Sport , supported by 1 public body .",https://www.gov.uk/government/organisations/department-for-digital-culture-media-sport,https://www.gov.uk/government/organisations/national-heritage-memorial-fund,
National Highways,NHMF,National Highways works with the Department for Transport .,https://www.gov.uk/government/organisations/department-for-transport,https://www.gov.uk/government/organisations/national-highways,
National Infrastructure Commission,NHMF,"The National Infrastructure Commission (NIC) provides the government with impartial, expert advice on major long-term infrastructure challenges. National Infrastructure Commission is an executive agency, sponsored by HM Treasury .",https://www.gov.uk/government/organisations/hm-treasury,https://www.gov.uk/government/organisations/national-infrastructure-commission,
National Institute for Health and Care Excellence,NICE,"The National Institute for Health and Care Excellence (NICE) provides national guidance and advice to improve health and social care. NICE is an executive non-departmental public body, sponsored by the Department of Health and Social Care .",https://www.gov.uk/government/organisations/department-of-health-and-social-care,https://www.gov.uk/government/organisations/national-institute-for-clinical-excellence,
National Leadership Centre,NLC,The National Leadership Centre helps leaders work together to improve public services. NLC is part of the Cabinet Office .,https://www.gov.uk/government/organisations/cabinet-office,https://www.gov.uk/government/organisations/national-leadership-centre,
National Lottery Heritage Fund,NLC,National Lottery Heritage Fund works with the National Heritage Memorial Fund .,https://www.gov.uk/government/organisations/national-heritage-memorial-fund,https://www.gov.uk/government/organisations/national-lottery-heritage-fund,
National Museum of the Royal Navy,RNM,"The Royal Naval Museum, in Portsmouth’s Historic Dockyard, is one of Britain’s oldest maritime museums. The Museum’s aim is to preserve and present the history of the ‘Fleet’ - the ships and the men and women who manned them. RNM is an executive non-departmental public body, sponsored by the Ministry of Defence .",https://www.gov.uk/government/organisations/ministry-of-defence,https://www.gov.uk/government/organisations/royal-naval-museum,
National Museums Liverpool,NML,"National Museums Liverpool (NML) is a diverse group of museums and galleries. Its collections are among the most important and varied in Europe, and contain everything from Impressionist paintings and rare beetles to a lifejacket from the Titanic and artefacts from ancient Egypt. NML is an executive non-departmental public body, sponsored by the Department for Digital, Culture, Media & Sport .",https://www.gov.uk/government/organisations/department-for-digital-culture-media-sport,https://www.gov.uk/government/organisations/national-museums-liverpool,
National Portrait Gallery,NPG,"The National Portrait Gallery (NPG) aims ‘to promote through the medium of portraits the appreciation and understanding of the men and women who have made and are making British history and culture, and to promote the appreciation and understanding of portraiture in all media’. It holds the most extensive collection of portraits in the world. NPG is an executive non-departmental public body, sponsored by the Department for Digital, Culture, Media & Sport .",https://www.gov.uk/government/organisations/department-for-digital-culture-media-sport,https://www.gov.uk/government/organisations/national-portrait-gallery,
National security and intelligence,NPG,"The National Security Secretariat provides coordination on security and intelligence issues of strategic importance across government. Separately, the Joint Intelligence Organisation produces independent all-source assessments on issues of national security and foreign policy importance. By supporting the work of the National Security Council and the Joint Intelligence Committee respectively, they provide advice on these issues to the Prime Minister and other senior ministers. National security and intelligence is part of the Cabinet Office .",https://www.gov.uk/government/organisations/cabinet-office,https://www.gov.uk/government/organisations/national-security,
National Security Technology and Innovation Exchange,NSTIx,"NSTIx is a government-led science, technology and innovation partnership that enables coherent and agile delivery of innovative national security outcomes through a coordinated and systematic approach to research and capability development.",,https://www.gov.uk/government/organisations/national-security-technology-and-innovation-exchange,
Natural England,Natural England,"We’re the government’s adviser for the natural environment in England. We help to protect and restore our natural world. Natural England is an executive non-departmental public body, sponsored by the Department for Environment, Food & Rural Affairs .",https://www.gov.uk/government/organisations/department-for-environment-food-rural-affairs,https://www.gov.uk/government/organisations/natural-england,
Natural Environment Research Council,NERC,"The Natural Environment Research Council (NERC) is the UK’s main agency for funding and managing research, training and knowledge exchange in atmospheric, Earth, biological, terrestrial and aquatic sciences. NERC works with the UK Research and Innovation .",https://www.gov.uk/government/organisations/uk-research-and-innovation,https://www.gov.uk/government/organisations/natural-environment-research-council,
Natural History Museum,NHM,"The Natural History Museum (NHM) is home to life and earth science specimens comprising some 70 million items within 5 main collections: Botany, Entomology, Mineralogy, Palaeontology and Zoology. The museum is a world-renowned centre of research, specialising in taxonomy, identification and conservation. Given the age of the institution, many of the collections have great historical as well as scientific value, such as specimens collected by Darwin. The Natural History Museum Library contains extensive books, journals, manuscripts, and artwork collections linked to the work and research of the scientific departments. NHM is an executive non-departmental public body, sponsored by the Department for Digital, Culture, Media & Sport .",https://www.gov.uk/government/organisations/department-for-digital-culture-media-sport,https://www.gov.uk/government/organisations/natural-history-museum,
Natural Resources Wales,NHM,"Natural Resources Wales ensures the environment and natural resources of Wales are sustainably maintained and used, now and in the future. Natural Resources Wales works with the Welsh Government .",https://www.gov.uk/government/organisations/welsh-government,https://www.gov.uk/government/organisations/natural-resources-wales,
Network Rail,NHM,"Network Rail owns, operates, maintains and develops Britain’s railway. Network Rail is responsible for ensuring that the railway is safe and reliable. Network Rail works with the Department for Transport .",https://www.gov.uk/government/organisations/department-for-transport,https://www.gov.uk/government/organisations/network-rail,
New Forest National Park Authority,NFNPA,"The New Forest National Park Authority (NFNPA) conserves and enhances the natural beauty, wildlife and cultural heritage of the New Forest and promotes opportunities for the understanding and enjoyment of the area by the public. NFNPA works with the Department for Environment, Food & Rural Affairs .",https://www.gov.uk/government/organisations/department-for-environment-food-rural-affairs,https://www.gov.uk/government/organisations/new-forest-national-park-authority,
NHS Blood and Transplant,NHSBT,"NHS Blood and Transplant (NHSBT) is responsible for the supply of blood, organs, tissues and stem cells. It collects and supplies blood to hospitals in England and is the organ donation organisation for the UK. NHSBT is a special health authority, sponsored by the Department of Health and Social Care .",https://www.gov.uk/government/organisations/department-of-health-and-social-care,https://www.gov.uk/government/organisations/nhs-blood-and-transplant,
NHS Business Services Authority,NHSBSA,"NHS Business Services Authority (NHSBSA) is responsible for providing high volume, predominantly transactional services which support the priorities of the NHS, government, and local health economies. NHSBSA administer national payment platforms for primary care services to pharmacists and dentists, develop and run HR and payroll platforms for NHS staff, administer the NHS Pension Scheme and provide a range of services direct to the public – helping citizens gain access to healthcare support costs to which they are entitled, including the new Global Health Insurance Card (GHIC) scheme. NHSBSA is a special health authority, sponsored by the Department of Health and Social Care .",https://www.gov.uk/government/organisations/department-of-health-and-social-care,https://www.gov.uk/government/organisations/nhs-business-services-authority,
NHS Counter Fraud Authority,NHSCFA,"The NHS Counter Fraud Authority (NHSCFA) is charged with identifying, investigating and preventing fraud and other economic crime within the NHS and the wider health group. Focused entirely on counter fraud work, the NHSCFA is independent from other NHS bodies and directly accountable to the Department of Health and Social Care, carrying out counter fraud functions in respect of the health service in England, on behalf of the Secretary of State. NHSCFA is a special health authority, sponsored by the Department of Health and Social Care .",https://www.gov.uk/government/organisations/department-of-health-and-social-care,https://www.gov.uk/government/organisations/nhs-counter-fraud-authority,
NHS England,NHSCFA,"NHS England authorises the new clinical commissioning groups, which are the drivers of the new, clinically-led commissioning system introduced by the Health and Social Care Act. Prior to 1 April 2013, NHS England was known as the NHS Commissioning Board. NHS England is an executive non-departmental public body, sponsored by the Department of Health and Social Care .",https://www.gov.uk/government/organisations/department-of-health-and-social-care,https://www.gov.uk/government/organisations/nhs-commissioning-board,
NHS Improvement,NHSCFA,"NHS Improvement and NHS England have worked together as a single organisation since 1 April 2019, to help improve care for patients and provide leadership and support to the wider NHS. NHS Improvement is an executive non-departmental public body, sponsored by the Department of Health and Social Care .",https://www.gov.uk/government/organisations/department-of-health-and-social-care,https://www.gov.uk/government/organisations/nhs-improvement,
NHS Pay Review Body,NHSPRB,"The NHS Pay Review Body (NHSPRB) advises on the pay of NHS staff. NHSPRB is an advisory non-departmental public body, sponsored by the Department of Health and Social Care .",https://www.gov.uk/government/organisations/department-of-health-and-social-care,https://www.gov.uk/government/organisations/nhs-pay-review-body,
NHS Resolution,NHSPRB,"NHS Resolution’s purpose is to provide expertise to the NHS to resolve concerns fairly, share learning for improvement and preserve resources for patient care. NHS Resolution is a special health authority, sponsored by the Department of Health and Social Care .",https://www.gov.uk/government/organisations/department-of-health-and-social-care,https://www.gov.uk/government/organisations/nhs-resolution,
NHS Wales Informatics Service,NHSPRB,"NHS Wales Information Service collects, stores and analyses and presents national data and statistical information for NHS Wales.",,https://www.gov.uk/government/organisations/nhs-wales-informatics-service,
North Sea Transition Authority,NSTA,"NSTA works with the Department for Business, Energy & Industrial Strategy .",https://www.gov.uk/government/organisations/department-for-business-energy-and-industrial-strategy,https://www.gov.uk/government/organisations/north-sea-transition-authority,
North York Moors National Park Authority,NYMNP,"The North York Moors National Park (NYMNP) authority conserves and enhances the natural beauty, wildlife and cultural heritage of the North York Moors and promotes opportunities for the understanding and enjoyment of the area by the public. NYMNP works with the Department for Environment, Food & Rural Affairs .",https://www.gov.uk/government/organisations/department-for-environment-food-rural-affairs,https://www.gov.uk/government/organisations/north-york-moors-national-park,
Northampton County Court Business Centre,NYMNP,The prefix route under which almost all government content is published.,https://www.gov.uk/government/organisations/hm-courts-and-tribunals-service,https://www.gov.uk/government/organisations/northampton-county-court-business-centre,
Northern Ireland Cancer Registry,NICR,"The Northern Ireland Cancer Registry (NICR) is located in the Centre for Public Health, Queen’s University Belfast and is funded by the Public Health Agency for Northern Ireland. The Department of Health (Northern Ireland) established the Northern Ireland Cancer Registry in 1994. NICR works with the Department of Health (Northern Ireland) .",https://www.gov.uk/government/organisations/department-of-health-northern-ireland,https://www.gov.uk/government/organisations/northern-ireland-cancer-registry,
"Northern Ireland Council for the Curriculum, Examinations and Assessment",CCEA,"The Council for the Curriculum, Examinations and Assessment is Northern Ireland’s awarding organisation, offering a range of qualifications. It advises the devolved government on what should be taught and assessed in schools and colleges, and monitors the standards of qualifications and examinations offered by all awarding organisations in Northern Ireland. CCEA is an executive non-departmental public body, sponsored by the Department of Education (Northern Ireland) .",https://www.gov.uk/government/organisations/department-of-education,https://www.gov.uk/government/organisations/northern-ireland-council-for-the-curriculum-examinations-and-assessment,
