label,altLabel,description,parent_organisations,hasRegisteredSite,hasPrimarySite
Easington and Seaham Education Action Zone,DSA,"Education Action Zones were partnerships of schools and other local interests, including business, which had the autonomy and flexibility to harness partners’ expertise and develop innovative educational strategies for the benefit of schools and local communities.",,https://www.gov.uk/government/organisations/easington-and-seaham-education-action-zone,
East Cleveland Education Action Zone,DSA,"Education Action Zones were partnerships of schools and other local interests, including business, which had the autonomy and flexibility to harness partners’ expertise and develop innovative educational strategies for the benefit of schools and local communities.",,https://www.gov.uk/government/organisations/east-cleveland-education-action-zone,
East Manchester Education Action Zone,DSA,"Education Action Zones were partnerships of schools and other local interests, including business, which had the autonomy and flexibility to harness partners’ expertise and develop innovative educational strategies for the benefit of schools and local communities.",,https://www.gov.uk/government/organisations/east-manchester-education-action-zone,
East Midlands Development Agency (emda),DSA,The East Midlands Development Agency was the regional development agency for the East Midlands region of England.,,https://www.gov.uk/government/organisations/east-midlands-development-agency-emda,
East of England Development Agency,DSA,The East of England Development Agency (EEDA) was a non-departmental public body and the regional development agency for the East of England region of England.,,https://www.gov.uk/government/organisations/east-of-england-development-agency,
Eastern Health and Social Services Board,DSA,"The Trust is an integrated organisation, incorporating acute hospital services, community health and social services.",,https://www.gov.uk/government/organisations/eastern-health-and-social-services-board,
Education Funding Agency,EFA,,https://www.gov.uk/government/organisations/department-for-education,https://www.gov.uk/government/organisations/education-funding-agency,
Efficiency and Reform Group,ERG,"The Efficiency and Reform Group (ERG) works in partnership with HM Treasury and government departments to deliver efficiencies, savings and reforms on behalf of UK taxpayers. ERG aims to save money, transform the way public services are delivered, improve user experience and support UK growth.",https://www.gov.uk/government/organisations/cabinet-office,https://www.gov.uk/government/organisations/efficiency-and-reform-group,
Eliasch Review,ERG,The review aimed to provide a comprehensive analysis of international financing to reduce forest loss and its associated impacts on climate change.,,https://www.gov.uk/government/organisations/eliasch-review,
Ellesmere Port Education Action Zone,ERG,"Education Action Zones were partnerships of schools and other local interests, including business, which had the autonomy and flexibility to harness partners’ expertise and develop innovative educational strategies for the benefit of schools and local communities.",,https://www.gov.uk/government/organisations/ellesmere-port-education-action-zone,
English Heritage,EH,"Historic England is the government’s statutory adviser on the historic environment, championing historic places and helping people to understand, value and care for them.",https://www.gov.uk/government/organisations/department-for-digital-culture-media-sport,https://www.gov.uk/government/organisations/english-heritage,
English Nature,EH,"English Nature promoted the conservation of wildlife, geology and wild places. It was merged with the Countryside Agency and Rural Development Service to form Natural England in 2006.",,https://www.gov.uk/government/organisations/english-nature,
English Partnerships,EH,"English Partnerships was the national regeneration agency, supporting high quality sustainable growth in England. It was a non-departmental public body sponsored by the Department for Communities and Local Government. It was replaced by the Homes and Communities Agency in 2008.",,https://www.gov.uk/government/organisations/english-partnerships,
English Sports Council,EH,Now known as Sport England.,,https://www.gov.uk/government/organisations/english-sports-council,
Enterprise Ulster,EH,Enterprise Ulster was a statutory employment training organisation established as a public corporation under The Enterprise Ulster (Northern Ireland) Order 1973. It was funded by the Department for Employment and Learning,,https://www.gov.uk/government/organisations/enterprise-ulster,
Environment and Heritage Service,EH,The Environment and Heritage Service is the government agency that advises on and promotes the conservation of Northern Ireland’s wildlife and natural features.,,https://www.gov.uk/government/organisations/environment-and-heritage-service,
Equal Opportunities Commission,EH,"The Equal Opportunities Commission (EOC) was an independent non-departmental public body, (NDPB) in the United Kingdom, which tackled sex discrimination and promoted gender equality. It was replaced by the Equality and Human Rights Commission.",,https://www.gov.uk/government/organisations/equal-opportunities-commission,
Equality 2025,E2025,"Equality 2025, a body of publicly-appointed disabled people, offered strategic, confidential advice to government on issues that affect disabled people.",https://www.gov.uk/government/organisations/department-for-work-pensions,https://www.gov.uk/government/organisations/equality-2025,
Equality Commission for Northern Ireland,E2025,"The Equality Commission for Northern Ireland is an independent public body established under the Northern Ireland Act 1998 and works to advance equality, promote equality of opportunity, encourage good relations and challenge discrimination through promotion, advice and enforcement.",,https://www.gov.uk/government/organisations/equality-commission-for-northern-ireland,
Equitable Life Inquiry,E2025,The Inquiry was established to look at the Financial Services Authority’s regulation of Equitable Life until 1999 and the supervisory work carried out up until December 2000.,,https://www.gov.uk/government/organisations/equitable-life-inquiry,
Examination team on child care procedures and practice in North Wales,E2025,The examination reviewed the provision of childcare and the employment of staff in the Social Services Departments of Gwynedd and Clwyd,,https://www.gov.uk/government/organisations/examination-team-on-child-care-procedures-and-practice-in-north-wales,
Exchequer and Audit Department,E2025,The Exchequer and Audit Department was the predecessor of the National Audit Office,,https://www.gov.uk/government/organisations/exchequer-and-audit-department,
Family Health Services Appeal Authority,E2025,The Family Health Services Appeal Authority hears appeals and applications resulting from decisions made by Primary Care Trust as part of the local management of such performers lists.,,https://www.gov.uk/government/organisations/family-health-services-appeal-authority,
FCO Services,FCO Services,"FCO Services was part of of the Foreign & Commonwealth Office (FCO), operating commercially as a Trading Fund to deliver secure, trusted services worldwide.",https://www.gov.uk/government/organisations/foreign-commonwealth-office,https://www.gov.uk/government/organisations/fco-services,
Financial Services Organisation,FCO Services,The UKTI Financial Services Organisation (FSO) helps attract inward investment to the UK and facilitates overseas trade in the financial and related professional service sectors.,https://www.gov.uk/government/organisations/uk-trade-investment,https://www.gov.uk/government/organisations/financial-services-organisation,
Financial Services Trade and Investment Board,FSTIB,We make sure that government policy supports financial services initiatives with high growth potential.,https://www.gov.uk/government/organisations/hm-treasury,https://www.gov.uk/government/organisations/financial-services-trade-and-investment-board,
Fire Authority for Northern Ireland,FSTIB,"Northern Ireland Fire & Rescue Service (NIFRS) is committed to ‘Protecting Our Community’. We respond to fires, road traffic collisions and other specialist rescue incidents and provide community safety education and advice.",,https://www.gov.uk/government/organisations/fire-authority-for-northern-ireland,
Firearms Consultative Committee,FSTIB,"This independent body was established under the Fireworks (Amendment) Act 1088 with a remit to keep under review the controls on firearms, to make recommendations to the Home Secretary as to how these may be improved, and to advise him on matters which he may refer to the Committee.",,https://www.gov.uk/government/organisations/firearms-consultative-committee,
Firebuy,FSTIB,Firebuy Limited was established in 2006 to deliver English Fire and Rescue Service (FRS) procurement at a national level.,,https://www.gov.uk/government/organisations/firebuy,
Fisheries Conservancy Board for Northern Ireland,FSTIB,The Fisheries Conservancy Board for Northern Ireland is a non-departmental public body established under the Fisheries Act and the fisheries (Amendment) (NI) Order.,,https://www.gov.uk/government/organisations/fisheries-conservancy-board-for-northern-ireland,
Food from Britain,FSTIB,Food for Britain was the Defra sponsored Non-Departmental Public Body promoting UK food exports between 1983 and 2009.,,https://www.gov.uk/government/organisations/food-from-britain,
Food Safety Promotion Board,FSTIB,"The Food Safety Promotion Board is principally charged with tasks involving food safety awareness - through public campaigns, conferences, training and advising professionals and the general public.",,https://www.gov.uk/government/organisations/food-safety-promotion-board,
Football Licensing Authority,FSTIB,FLA was responsible for ensuring safe conditions at football grounds in England and Wales. It became the Sports Ground Safety Authority in 2011.,,https://www.gov.uk/government/organisations/football-licensing-authority,
Foreign & Commonwealth Office,FCO,"The Foreign and Commonwealth Office (FCO) has closed. It’s been replaced by the Foreign, Commonwealth & Development Office (FCDO). FCDO guidance, services and information These services are now provided by FCDO: foreign travel advice consular help and services abroad document legislation History of FCO FCO was a ministerial department from October 1968 to September 2020. It merged with the Department for International Development to create FCDO.",,https://www.gov.uk/government/organisations/foreign-commonwealth-office,
Foreign Compensation Commission,FCC,The Foreign Compensation Commission works out the amount of compensation British claimants are entitled to under international and British law for losses suffered abroad. It also helps in the settlement negotiations of British property losses overseas at the hands of foreign governments.,,https://www.gov.uk/government/organisations/foreign-compensation-commission,
Forensic Science Northern Ireland,FCC,Forensic Science Northern Ireland (FSNI) is an Agency within the Department of Justice working to provide effective impartial forensic science to support justice.,,https://www.gov.uk/government/organisations/forensic-science-northern-ireland,
Forensic Science Service,FCC,"The Forensic Science Service (FSS) was a government-owned company in the United Kingdom which provided forensic science services to the police forces and government agencies of England and Wales, as well as other countries.",,https://www.gov.uk/government/organisations/forensic-science-service,
Forest Service,FCC,The Forest Service is an Executive Agency within the Department of Agriculture and Rural Development.,,https://www.gov.uk/government/organisations/forest-service,
Fuel Poverty Advisory Group,FPAG,"The Fuel Poverty Advisory Group ( FPAG ) is now called the Committee on Fuel Poverty . FPAG advised on the effectiveness of policies aimed at reducing fuel poverty, and encouraged greater co-ordination across the organisations working to reduce fuel poverty.",https://www.gov.uk/government/organisations/department-of-energy-climate-change,https://www.gov.uk/government/organisations/the-fuel-poverty-advisory-group,
Further and Higher Education Funding Councils for Wales,FPAG,The Higher and Further Education Funding Councils were the two organisations responsible for the allocation of funds made available for the purposes of education and research.,,https://www.gov.uk/government/organisations/further-and-higher-education-funding-councils-for-wales,
Gaming Board for Great Britain,FPAG,"The Board was responsible for regulating arcades, betting, bingo, casinos, slot machines and lotteries. It was replaced by the Gambling Commission in 2007.",,https://www.gov.uk/government/organisations/gaming-board-for-great-britain,
Gangmasters Licensing Authority,GLA,,https://www.gov.uk/government/organisations/home-office,https://www.gov.uk/government/organisations/gangmasters-licensing-authority,
Gas and Electricity Consumer Council (Energywatch),GLA,Energywatch was responsible for protecting and promoting the interests of all gas and electricity consumers in Great Britain. Energywatch was created in November 2000 and desolved in 2008 when it became Consumer Focus.,,https://www.gov.uk/government/organisations/gas-and-electricity-consumer-council-energywatch,
General Consumer Council for Northern Ireland,GLA,"The Consumer Council was set up by Government in 1985 and is funded by the Department of Enterprise, Trade and Investment (DETI).",,https://www.gov.uk/government/organisations/general-consumer-council-for-northern-ireland,
General Social Care Council,GLA,The General Social Care Council (GSCC) was a non-departmental public body of the Department of Health in the United Kingdom which was the regulator of social workers and social work students in England.,,https://www.gov.uk/government/organisations/general-social-care-council,
General Teaching Council for England,GTCE,"The General Teaching Council for England was the professional body for teaching in England. It was abolished in 2012, with some of its responsibilities transferring to the Teaching Agency.",,https://www.gov.uk/government/organisations/general-teaching-council-for-england,
Gloucester Education Action Zone,GTCE,"Education Action Zones were partnerships of schools and other local interests, including business, which had the autonomy and flexibility to harness partners’ expertise and develop innovative educational strategies for the benefit of schools and local communities.",,https://www.gov.uk/government/organisations/gloucester-education-action-zone,
Government Car and Despatch Agency,GTCE,The GCDA was reponsible for providing cars and drivers to ministers and senior civil servants and moving government mail between government buildings and locations. It became the Government Car Service in 2012 and operates from within the Department for Transport,,https://www.gov.uk/government/organisations/government-car-and-despatch-agency,
Government Finance Profession,GTCE,"We support civil servants who work in, or are involved with, embedding the professional finance culture across government.",https://www.gov.uk/government/organisations/civil-service,https://www.gov.uk/government/organisations/civil-service-government-finance-profession,
Government IT Profession,GTCE,,https://www.gov.uk/government/organisations/civil-service,https://www.gov.uk/government/organisations/civil-service-government-it-profession,
Government Legal Service,GLS,Government lawyers provide legal advice to the government and represent it in court proceedings,https://www.gov.uk/government/organisations/civil-service,https://www.gov.uk/government/organisations/civil-service-government-legal-service,
Government Procurement Service,GPS,"The Government Procurement Service (GPS) is now part of the Crown Commercial Service, a new organisation which also includes the former commercial function of the Cabinet Office, and common goods and services procurement and commercial management currently undertaken by departments.",,https://www.gov.uk/government/organisations/government-procurement-service,
Government Property Profession,GPS,"The Government Property Profession is a network of over 2,000 members with responsibility for a range of property-related activities.",https://www.gov.uk/government/organisations/civil-service,https://www.gov.uk/government/organisations/civil-service-government-property-profession,
Gowers Review of Intellectual Property,GPS,The Gowers Review of Intellectual Property was an independent review of UK intellectual property (IP) focusing on UK copyright law that was published in December 2006.,,https://www.gov.uk/government/organisations/gowers-review-of-intellectual-property,
Great Yarmouth Education Action Zone,GPS,"Education Action Zones were partnerships of schools and other local interests, including business, which had the autonomy and flexibility to harness partners’ expertise and develop innovative educational strategies for the benefit of schools and local communities.",,https://www.gov.uk/government/organisations/great-yarmouth-education-action-zone,
Greenwich Education Action Zone,GPS,"Education Action Zones were partnerships of schools and other local interests, including business, which had the autonomy and flexibility to harness partners’ expertise and develop innovative educational strategies for the benefit of schools and local communities.",,https://www.gov.uk/government/organisations/greenwich-education-action-zone,
H.M. Customs and Excise,GPS,H.M. Customs and Excise is now a part of H.M. Revenue and Customs.,,https://www.gov.uk/government/organisations/hm-customs-and-excise,
H.M. Inspectorate of Court Administration,GPS,"HM Inspectorate of Court Administration (HMICA) has a duty, under the Courts Act 2003, to inspect the systems that support the Crown, county and magistrates’ courts in England and Wales.",,https://www.gov.uk/government/organisations/hm-inspectorate-of-court-administration,
H.M. Inspectorate of Explosives for Northern Ireland,GPS,The Inspectorate is responsible for regulating premises or organisations in Northern Ireland which handle or sell explosive materials as defined under the Explosives Act 1875,,https://www.gov.uk/government/organisations/hm-inspectorate-of-explosives-for-northern-ireland,
Hackney Education Action Zone,GPS,"Education Action Zones were partnerships of schools and other local interests, including business, which had the autonomy and flexibility to harness partners’ expertise and develop innovative educational strategies for the benefit of schools and local communities.",,https://www.gov.uk/government/organisations/hackney-education-action-zone,
Hamilton Oxford Education Action Zone,GPS,"Education Action Zones were partnerships of schools and other local interests, including business, which had the autonomy and flexibility to harness partners’ expertise and develop innovative educational strategies for the benefit of schools and local communities.",,https://www.gov.uk/government/organisations/hamilton-oxford-education-action-zone,
Hastings and St Leonards Education Action Zone,GPS,"Education Action Zones were partnerships of schools and other local interests, including business, which had the autonomy and flexibility to harness partners’ expertise and develop innovative educational strategies for the benefit of schools and local communities.",,https://www.gov.uk/government/organisations/hastings-and-st-leonards-education-action-zone,
Health and Social Care Information Centre,HSCIC,"We are the national provider of information, data and IT systems for commissioners, analysts and clinicians in health and social care.",https://www.gov.uk/government/organisations/department-of-health-and-social-care,https://www.gov.uk/government/organisations/health-and-social-care-information-centre,
Health Protection Agency,HSCIC,"The Health Protection Agency’s role was to provide an integrated approach to protecting UK public health through the provision of support and advice to the NHS, local authorities, emergency services, other Arms Length Bodies, the Department of Health and the others. The HPA became part of Public Health England in 2013.",,https://www.gov.uk/government/organisations/health-protection-agency,
Healthcare Commission,HSCIC,"The Commission for Healthcare Audit and Inspection, also known as the Healthcare Commission was created in 2004. It was responsible for assessing standards of care provided by the NHS. Its responsibilities were taken over by the Care Quality Commission in 2009.",,https://www.gov.uk/government/organisations/healthcare-commission,
Hearing Aid Council,HSCIC,The Hearing Aid Council was a statutory regulator set up by the Hearing Aid Council Act (1968) to register dispensers and their employers working in the private hearing aid sector. The Health Professions Council took responsibilty for regulating the sector in 2010.,,https://www.gov.uk/government/organisations/hearing-aid-council,
Heart of Slough Education Action Zone,HSCIC,"Education Action Zones were partnerships of schools and other local interests, including business, which had the autonomy and flexibility to harness partners’ expertise and develop innovative educational strategies for the benefit of schools and local communities.",,https://www.gov.uk/government/organisations/heart-of-slough-education-action-zone,
Her Majesty's Magistrates Courts Service Inspectorate,HSCIC,"Her Majesty’s Magistrates Courts Service Inspectorate (MCSI) was responsible for the inspection of the systems that support the Crown, county and magistrates’ courts in England and Wales. It has now closed.",https://www.gov.uk/government/organisations/ministry-of-justice,https://www.gov.uk/government/organisations/her-majestys-magistrates-courts-service-inspectorate,
Heritage Lottery Fund (administered by the NHMF),HLF,"Using money raised through the National Lottery, the Heritage Lottery Fund (HLF) gives grants to sustain and transform the UK’s heritage. Museums, parks, historic places, archaeology, natural environment and cultural traditions all receive investment.",https://www.gov.uk/government/organisations/department-for-digital-culture-media-sport,https://www.gov.uk/government/organisations/heritage-lottery-fund,
Higher Education Funding Council for England,HEFCE,The Higher Education Funding Council for England (HEFCE) distributed public money for teaching and research to universities and colleges. It closed on 1 April 2018.,https://www.gov.uk/government/organisations/department-for-education,https://www.gov.uk/government/organisations/higher-education-funding-council-for-england,
Highways Agency,HA,,https://www.gov.uk/government/organisations/department-for-transport,https://www.gov.uk/government/organisations/highways-agency,
Highways England,Highways England,"Highways England operates, maintains and improves England’s motorways and major A roads.",https://www.gov.uk/government/organisations/department-for-transport,https://www.gov.uk/government/organisations/highways-england,
Hillsborough Independent Panel,Highways England,The Hillsborough Independent Panel was established to oversee the disclosure of information relating to the Hillsborough disaster.,,https://www.gov.uk/government/organisations/hillsborough-independent-panel,
HM Courts Service,Highways England,"Her Majesty’s Courts Service was an executive agency of the Ministry of Justice and was responsible for the administration of the civil, family and criminal courts in England and Wales. It was merged with the Tribunal Service in 2011 to form Her Majesty’s Courts and Tribunal Service .",,https://www.gov.uk/government/organisations/hm-court-service,
HM Inspectorate of Constabulary,HMIC,"HM Inspectorate of Constabulary (HMIC) independently assesses police forces and policing, asking the questions that citizens would ask and publishing information to allow the public to compare the performance of their force against others.",https://www.gov.uk/government/organisations/home-office,https://www.gov.uk/government/organisations/hm-inspectorate-of-constabulary,
Home-Grown Cereals Authority,HMIC,The HGCA is the levy board for the cereals and oilseed supply chain. It is a part of the Agriculture and Horticulture Development Board,,https://www.gov.uk/government/organisations/home-grown-cereals-authority,
Homes and Communities Agency,HCA,"The Homes and Communities Agency (HCA) was a executive non-departmental public body, sponsored by the Department for Communities and Local Government. It was replaced by in January 2018 by Homes England and the Regulator of Social Housing . It helped create successful communities by making more homes and business premises available to the residents and businesses who need them. It also regulated social housing providers in England.",https://www.gov.uk/government/organisations/ministry-of-housing-communities-and-local-government,https://www.gov.uk/government/organisations/homes-and-communities-agency,
Horticultural Development Council,HCA,The HDC was responsible for near-market research and development in the horticultural sector. It became a part of the Agricultural and Horticultural Development Board in 2008.,,https://www.gov.uk/government/organisations/horticultural-development-council,
Housing Corporation,HCA,The Housing Corporation was the non-departmental public body that funded new affordable housing and regulated housing associations in England. It was abolished in 2008 with its responsibilities being split between the Homes and Communities Agency and the Tenant Services Authority.,,https://www.gov.uk/government/organisations/housing-corporation,
